Key	Code	Name	GovProgram_Id	ResponsibleFOIV_Id	ResponsibleForInput_Id	Instruments	Goals	Tasks	FinancingSources	Results	Element_Id	FullName	StatusName	Id	ord	Executor	StartDate	EndDate
56	14Е	Развитие Москвы как Международного финансового центра	1	57	 	 	Развитие возможностей города для функционирования города Москвы как международного финансового центра в сферах финансовой, банковской, биржевой инфраструктуры и всех видов страховой деятельности, инфраструктуры города Москвы, улучшения инвестиционного климата	Формирование транспортной, инженерной и социальной инфраструктуры, соответствующей международным стандартам и качеству жизни. Обеспечение безопасности пребывания физических лиц на территории города Москвы.  Содействие развитию финансовой инфраструктуры, предпринимательского климата в городе Москве. Формирование положительного восприятия международным деловым сообществом города Москвы как динамично развивающегося международного финансового центра.  Привлечение финансовых ресурсов населения в финансовую систему города Москвы, рост экономической активности населения 	всего бюджет города Москвы юридические лица федеральный бюджет	— увеличение доли финансового сектора в структуре валового регионального продукта; — развитие крупных инфраструктурных проектов внутри города Москвы; — создание новых рабочих мест в финансовой сфере, повышение уровня квалификации персонала; — увеличение доли налоговых доходов от финансовой деятельности в общем объеме налоговых доходов; — увеличение притока иностранных инвестиций; — положительное восприятие города Москвы как международного финансового центра мировым инвестиционным сообществом. 	2	a0f5e278d41340b3b4ff0c52cf01071f	56
231	14Г	Реструктуризация и стимулирование развития промышленности в городе Москве	1	9	 	 	Увеличение конкурентоспособности экономики города Москвы за счет повышения ресурсоэффективности действующих производств, создания и развития высокотехнологичных предприятий и роста эффективности использования промышленных территорий	1. Оптимизация территориального распределения организаций промышленности и науки, повышение плотности размещения объектов промышленности. 2. Увеличение числа конкурентоспособных промышленных производств за счет модернизации, в том числе путем проведения мероприятий по стимулированию ресурсосбережения и реструктуризации неэффективных предприятий. 3. Создание новых и развитие действующих наукоемких и высокотехнологичных производств, в том числе за счет привлечения прямых инвестиций. 4. Повышение уровня безопасности промышленных объектов. 5. Усиление кооперации между крупными, средними и малыми промышленными предприятиями. 6. Совершенствование системы кадрового обеспечения промышленности. 7. Совершенствование условий промышленной и инвестиционной деятельности в городе Москве 	всего бюджет города Москвы юридические лица федеральный бюджет	В результате реализации Подпрограммы ожидается: 1. Повышение конкурентоспособности и финансовой устойчивости промышленных предприятий: — запуск до 30 инвестиционных проектов по созданию новых высокотехнологичных производств. 2. Повышение ресурсоэффективности действующих обрабатывающих производств: — рост средней выручки с единицы занимаемой площади по обрабатывающим производствам (за исключением производства нефтепродуктов) с 24,7 тыс. руб./кв. м в 2009 году до 35 тыс. руб./кв. м в 2016 году; — рост производительности (выработки) на одного работающего по обрабатывающим производствам (по крупным и средним предприятиям) (за исключением производства нефтепродуктов) с 3,3 млн. руб. в 2010 году до 5 млн. руб. в 2016 году. 3. Высвобождение земельных участков для размещения новых производств: — рост среднего объема отгруженной продукции с единицы занимаемой площади по обрабатывающим производствам (за исключением производства нефтепродуктов) с 21,9 тыс. руб./кв. м в 2010 году до 31 тыс. руб./кв. м в 2016 году. — ежегодный темп роста индекса промышленного производства по обрабатывающим производствам — не менее 3—4%. 4. Перебазирование за пределы города Москвы неэффективных и экологически опасных производств при их технологической модернизации. 5. Создание центров подготовки и переподготовки кадров по новым и востребованным специальностям на базе современных производств: — рост среднемесячной заработной платы за период 2012—2016 годов относительно 2011 года — не менее 161%. 6. Рост качества профессионального технического образования. 7. Оптимизация возрастной структуры персонала организаций промышленности. 8. Повышение привлекательности организаций промышленности для инвесторов, в том числе иностранных: — увеличение общего объема инвестиций в основной капитал обрабатывающих производств с 19 500 млн. руб. в 2011 году до 30 387 млн. руб. в 2016 году; — увеличение объема накопленных прямых иностранных инвестиций в обрабатывающие производства с 33 360 млн. долл. США в 2011 году до 67 100 млн. долл. США в 2016 году. 9. Развитие межрегионального и международного сотрудничества; 10. Расширение рынков экспорта высокотехнологичной продукции; 11. Достижение объема инвестиций в ВРП города Москвы в 25,7% к 2016 году; 12. рост производительности труда к 2016 году в 1,3 раза относительно уровня 2011 года.	2	9057f1014807477d8b6e32cfd452357a	231
260	14Д	Москва-инновационная столица России	1	9	 	 	Повышение качества жизни и конкурентоспособности Москвы через создание благоприятных условий для инновационной деятельности 	1.	Увеличение числа занятых инновационной деятельностью в Москве 2.	Рост доли инновационной продукции в ВРП города Москвы 3.	Повышение эффективности работы инновационной инфраструктуры 4.	Продвижение Москвы как лидирующего  мирового центра инноваций	всего бюджет города Москвы юридические лица федеральный бюджет	В результате реализации Подпрограммы ожидается: — повышение уровня информированности субъектов инновационной деятельности о различных формах финансовой поддержки, программах институтов инновационного развития Российской Федерации, в том числе за счет создания Центра инновационного развития; — повышение профессионального уровня кадров, вовлеченных в инновационную деятельность, в том числе за счет реализации программ повышения квалификации в рамках Центра инновационного развития; — популяризация инноваций и инновационной деятельности в городе Москве, в том числе за счет увеличения численности занятых исследованиями и разработками на 10 тыс. чел. до 460 чел.; — стимулирование инновационной деятельности, в том числе посредством увеличения заказа города Москвы на инновационную продукцию до 38 млрд. руб.; — создание благоприятных условий для развития инновационного бизнеса.	2	8f10535c66904e96b6b0377edd5714b1	260
412	14А	Развитие рынка труда и содействие занятости населения города Москвы	1	44	 	 	Содействие рационализации структуры трудовой занятости населения города Москвы с учетом приоритетов развития экономики города Москвы	1. Информационно-аналитическое обеспечение развития рынка труда и сферы занятости населения города Москвы. 2. Содействие гражданам в получении работы с достойным уровнем оплаты труда. 3. Обеспечение оптимизации привлечения иностранной рабочей силы на рынок труда города Москвы. 4. Содействие формированию трудовых ресурсов в соответствии с потребностями экономики города Москвы. 5. Обеспечение безопасных условий труда в организациях независимо от форм собственности, расположенных в городе Москве. 6. Повышение качества и доступности услуг службы занятости населения, обеспечение социальной и материальной поддержки безработных граждан, развитие социального партнерства в сфере занятости населения города Москвы.	всего бюджет города Москвы юридические лица федеральный бюджет	В результате реализации подпрограммы: — уровень регистрируемой безработицы не превысит показателя, согласованного участниками Московского трехстороннего соглашения по годам реализации подпрограммы; — коэффициент напряженности на рынке труда города Москвы в среднегодовом исчислении сохранит стабильность и начнет постепенно снижаться; — закрепится тенденция роста доли трудоустроенных граждан в общей численности граждан, которые будут обращаться в службу занятости с целью поиска подходящей работы; — увеличится численность зарегистрировавших предпринимательскую деятельность при содействии службы занятости безработных граждан; — численность граждан, ежегодно проходящих профессиональную подготовку, переподготовку и повышение квалификации при содействии службы занятости составит более 50 тыс. человек; — ежегодно в общественных работах будут принимать участие более 28,5 тыс. человек; — снизится уровень производственного травматизма; — сократится доля иностранной рабочей силы на рынке труда города Москвы.	2	84f5eb0cccd04836b1ae5d2735f23891	412
609	14В	Развитие малого и среднего предпринимательства в городе Москве	1	9	 	 	Увеличение конкурентоспособности экономики города Москвы за счет создания благоприятных условий для предпринимательской деятельности и обеспечения устойчивого развития малого и среднего предпринимательства, в том числе микропредприятий и индивидуальных предпринимателей	1)	Обеспечение устойчивого развития малого и среднего предпринимательства, в том числе микропредприятий и индивидуальных предпринимателей. 2)	Увеличение вклада малого и среднего предпринимательства в экономику города Москвы. 3)	Увеличение числа занятого населения в малом и среднем предпринимательстве. 4)	Создание эффективной системы поддержки малого и среднего предпринимательства. 5)	Улучшение условий для осуществления предпринимательской деятельности. 6)	Стимулирование малых и средних предприятий города Москвы к повышению прозрачности своей деятельности и создание необходимых для этого условий. 	всего бюджет города Москвы юридические лица федеральный бюджет	В результате реализации Подпрограммы ожидается: 1) Выполнение целевых индикаторов и показателей Подпрограммы: • Увеличение оборота малых и микропредприятий более чем на 900 млрд. руб.; • Рост занятого населения в малом и среднем предпринимательстве на 11% (создание более 180 тыс. рабочих мест); • Повышение уровня производительности труда на малых и средних предприятиях на 11% относительно уровня 2011 года; • Рост количества малых и микропредприятий на 17,3 тыс. организаций (приблизительно на 8%); • Увеличение доли налоговых поступлений от малых и средних предприятий в бюджет города Москвы с 10% до 12,1%; • Увеличение доли малых предприятий, имеющих прибыль от финансово-хозяйственной деятельности по итогам года с 61,1% до 66,6%; • Повышение позиции в рейтинге Всемирного банка по условиям ведения бизнеса со 120 до 40 позиции. 2) Достижение качественных улучшений в области развития малого и среднего предпринимательства в городе Москве: • Рост рейтинга города Москвы по состоянию деловой среды относительно других крупных городов России; • Рост уровня удовлетворенности предпринимателей состоянием деловой среды и работой инфраструктуры поддержки малого и среднего предпринимательства; • Повышение информированности малых и средних предприятий города Москвы о мерах поддержки предпринимательской деятельности и способах ее получения	2	5de974b06cac4eff93738c538d9146ee	609
885	14Ж	Иные мероприятия, реализуемые в рамках государственной программы "Стимулирование экономической активности"	1	57	 	 	 	 	всего бюджет города Москвы юридические лица федеральный бюджет	 	2	f019bac97d4941c68e84d252c7b2e2e1	885
