Key	Code	Name	GovProgram_Id	ResponsibleFOIV_Id	ResponsibleForInput_Id	Instruments	Goals	Tasks	FinancingSources	Results	Element_Id	FullName	StatusName	Id	ord	Executor	StartDate	EndDate
28	15Ж	Обеспечение инновационного развития строительного комплекса.	1	47	 	 	Создание условий для инновационного развития строительного комплекса Москвы в соответствии с приоритетами градостроительной политики.	1.	Разработка и реализация программы развития предприятий промышленности строительных материалов и индустриального домостроения до 2020г. 2.	Организация взаимодействия (в том числе информационного) с предприятиями строительной индустрии города Москвы и других близлежащих регионов России.  3.	Научно-техническая и научно-методическая поддержка инновационного развития строительного комплекса Моск-вы. 4.	Внедрение передовых инновационных технологий в строительном комплексе Москвы.  5.	Актуализация и реализация ведомственной программы «Энергосберегающее домостроение». 6.	Подготовка высококвалифицированных кадров для реализации градостроительной политики. 	всего бюджет города Москвы юридические лица федеральный бюджет	1.	Подготовлен 21 проект законодательных и иных нормативно-правовых актов, устанавливающих нормативные требования по проектированию зданий и сооружений различного назначения. 2.	Удельное потребление энергии на отопление, вентиляцию, кондиционирование, горячее водоснабжение, освещение и эксплуатацию общедомового инженерного оборудования вновь построенных, реконструированных или прошедших капитальный ремонт и вводимых в эксплуатацию  многоквартирных жилых домов  высотой более 12 этажей снизится до 130 кВт•ч/кв. м в год. 3.	Удельное потребление энергии на отопление, вентиляцию, кондиционирование, горячее водоснабжение, освещение и эксплуатацию инженерного оборудования вновь построенных, реконструированных или прошедших капитальный ремонт и вводимых в эксплуатацию социальных и общественно-деловых зданий снизится до 112 кВт•ч/кв. м  в год. 4.	Установлено 14 автоматизированных стационарных станций мониторинга эксплуатации уникальных и техниче-ски сложных зданий и сооружений.  	2	1f65a48929d44913b246068339b78555	28
66	15З	Научно-методическое и информационно-аналитическое обеспечение градостроительной деятельности.	1	47	 	 	Создание научно-методического и информационно-аналитического базиса для градостроительной деятельности в Москве.	1.	Научное и научно-методическое обеспечение градостроительной деятельности. 2.	Информационно-аналитическое обеспечение градостроительной деятельности.  3.	 Оптимизация организационной структуры централизованного информационно-аналитического обеспечения градостроительной деятельности в городе Москве. 	всего бюджет города Москвы юридические лица федеральный бюджет	1.	Проведено 50 мероприятий, посвященных градостроительной политике Москвы. 2.	Актуализация научно-методической обеспеченности документов и документации градостроительного проектирования достигла 100%. 3.	Внедрение результатов НИР  в области градостроительного проектирования достигло100%. 4.	В результате оптимизации организационной структуры централизованного информационно-аналитического обеспечения градостроительной деятельности, количество дей-ствующих информационных систем в Комплексе градостроительной политики и строительства сократилось на 42% и составило 35 единиц. 5.	Доля интегрированных в автоматизированную информационно-аналитическую систему управления градостроительной деятельностью автоматизированных информационных систем и ресурсов Комплекса градостроительной политики и строительства города Москвы достигнет 100%. 6.	Доля автоматизированных рабочих мест, подключенных к автоматизированным информационным системам и ресурсам Департамента градостроительной политики города Москвы посредством структурированных кабельных сетей со скоростью 100 Мгб/сек., достигнет 100%. 7.	Доля данных, получаемых в режиме «on-line» от по-ставщиков информации, достигнет 100%. 8.	Доля выявленных ошибок при предоставлении данных поставщиками информации снизится с 30% до 1—2%. 9.	Доля отказов в работе автоматизированных информационных систем и ресурсов вследствие отказов источников бесперебойного электропитания и систем кондиционирования снизится с 5 до 0%.  10.	Доля аналитических отчетов, подготовленных в автоматическом режиме с использованием данных, содержащихся в автоматизированных информационных системах и ресурсах Комплекса градостроительной политики и строительства города Москвы вырастет с 5% до 100%. 11.	Количество пользователей, посещающих информационные порталы и официальные сайты органов исполнительной власти, входящих в Комплекс градостроительной политики и строительства города Москвы, вырастет с 30 000—32 000 до 100 000—120 000. 12.	Автоматизация типовых процессов деятельности Москомархитектуры по подготовке и выпуску документации градостроительного проектирования: •	исходные данные для проектирования и проектов для согласования предоставляются полностью в электронном виде; •	доля  программных мероприятий, формируемых в электронном виде, составит 90%. •	доля  проектной документации, хранящейся в электронном виде, допускающем аналитическую обработку (для новой проектной документации), составит 90%. 13.	Производительность ИАИС ОГД: •	количество регистрируемых документов за год увеличится до 11 600; •	количество обработанных обращений пользователей ОИВ через вебдоступ увеличится до 900 тыс.; •	количество выданных справок и копий документов по письменным запросам ЮЛ и ФЛ увеличится до 3500. •	количество обращений ЮЛ и ФЛ через портал госулуг, увеличится до 590 тыс. единиц.  	2	d0455ab0c1104030b55c0da3348f31a2	66
288	15В	Комплексное обустройство исторического центра, реконструкция, реновация и реорганизация городских территорий, комплексная городская застройка на периферии города	1	47	 	 	Сбалансированное градостроительное развитие городских территорий: благоустройство исторического центра, реновация сложившейся застройки, реорганизация территорий, застройка на периферии города.	1.	Сохранение и восстановление объектов культурного на-следия. 2.	Формирование архитектурно-художественного облика города Москвы с учетом территорий особой градостроительной ценности. 3.	Разработка программ градостроительного  развития  административных округов и территорий города Москвы, подлежащих градостроительной реорганизации.  4.	Комплексная реконструкция и благоустройство исторического центра города. 5.	Развитие территорий срединной зоны города.  6.	Развитие территорий периферийной части города. 7.	Строительство объектов различного функционального назначения, размещаемых за пределами границ города Москвы. 8.	Реорганизация производственных территорий Москвы.  9.	Координация работ по проектированию и  строительству за счет бюджета города Москвы объектов транспортной, инженерной, социальной инфраструктуры, необходимых для объектов горзаказа и внебюджетных объектов. 10.	Реализация программы освоения подземного пространства города. 11.	Выполнение  взятых обязательств по государственным контрактам по строительству и вводу в эксплуатацию объектов, строящихся ранее по программе ДИПС.  12.	Строительство и реконструкция объектов  городской собственности города Москвы. 13.	Строительство объектов по добыче и обработке стройматериалов, используемых в строительном комплексе Мо-сквы. 14.	Освобождение территории, подготовка документации и участков для проведения аукционов на право развития застроенных территорий.  	всего бюджет города Москвы юридические лица федеральный бюджет	1.	Комфортность городской среды: •	обеспеченность населения жильем (Московский регион) составит 24,0 кв. м/чел;  •	обеспеченность социальной инфраструктурой (в % от нормативной обеспеченности): 	поликлиники — 102%; 	городские общественные здания, доступные для  инвалидов и других маломобильных групп населения, — 85%; •	обеспеченность транспортной инфраструктурой: 	доля населения, не обслуженного метрополитеном сократится до 13%; 	средняя скорость в час «пик» на наземном   общественном транспорте составит 18 км/ч; 	количество парковочных мест увеличится на 93%: •	экологическая ситуация: 	снижение объема выбросов загрязняющих веществ от стационарных источников до 58,8 тыс. тонн; 	стабилизация выбросов загрязняющих веществ автотранспортом на уровне 2010 г. в размере 1 млн тонн в год; 	снижение объемов захоронения твердых бытовых отходов (ТБО) и крупногабаритного мусора (КГМ) жилого сектора с учетом захоронения остатков от промышленной переработки до 1171 тыс. тонн; 	доля площади города, обеспеченной сетями     водостока, составит 91,6 %; 	доля сточных вод, очищенных до нормативных значений, в общем объеме сточных вод составит 75%.  2.	Историко-культурные исследования кварталов в ЦАО   г. Москвы, являющихся объектами культурного наследия, выполнены в количестве  423 шт. 3.	Разработано 10 программ по комплексному градостроительному развитию административных округов. 4.	Обязательства по государственным контрактам по строительству объектов, строящихся ранее по программе ДИПС, выполнены на 100%. 5.	Работы по проектированию и  строительству за счет бюджета города Москвы объектов транспортной, инженерной, социальной инфраструктур, необходимых для объек-тов горзаказа и внебюджетных объектов, выполнены на 100%. 6.	Работы по строительству и реконструкции объектов  городской собственности города Москвы выполнены на 100%. 7.	Работы по строительству объектов по добыче и обработке стройматериалов, используемых в строительном комплексе Москвы, выполнены на 100%. 8.	Работы по освобождению территории и подготовка земельных участков для выставления на инвестиционные торги выполнены на 100%. 9.	Разработана и утверждена Программа освоения подземного пространства города Москвы. 10.	Разработана и утверждена Концепция развития комплексного благоустройства территорий в зонах стабилизации.  	2	5cfef9740da94014986440c98f218369	288
562	15Д	Нормативно-правовое и нормативно-техническое обеспечение градостроительной деятельности (включая мероприятия по снижению административных барьеров)	1	47	 	 	Создание нормативно-правовой и нормативно-технической базы градостроительной политики.	1.	Нормативно-правовое обеспечение градостроительной деятельности. 2.	Нормативно-техническое обеспечение градостроительной деятельности.  3.	Разработка новой и поддержание в актуальном состоянии действующей сметно-нормативной базы ценообразования в строительстве города Москвы. 4.	Снижение административных барьеров.  	всего бюджет города Москвы юридические лица федеральный бюджет	1.	Разработано и актуализировано 25 норм, правил, национальных стандартов, регламентов и других нормативно-технических документов в области проектирования, строительства и безопасной эксплуатации зданий и сооружений. 2.	Количество органов исполнительной власти, предприятий и организаций, чье согласование необходимо получить в период предоставления земельного участка в аренду для строительства (кроме жилищного), начиная от даты подачи заявки на предоставление земельного участка в аренду для строительства (кроме жилищного) до даты выдачи разрешения на ввод объекта капитального строитель-ства в эксплуатацию, снизится до 38 в 2013 году. 3.	Доля земельных участков в Москве, предоставленных для строительства (кроме жилищного) по результатам торгов, в общей площади земельных участков в Москве, пре-доставленных для строительства (кроме жилищного), дос-тигнет 20% в 2013 году.  	2	d0b7acfaeb2b4763ac298265a404336d	562
