Key	Code	Name	GovProgram_Id	ResponsibleFOIV_Id	ResponsibleForInput_Id	Instruments	Goals	Tasks	FinancingSources	Results	Element_Id	FullName	StatusName	Id	ord	Executor	StartDate	EndDate
37	16Е	Управление и реформирование государственных организаций (государственных унитарных предприятий, казенных предприятий и государственных учреждений)	1	10	 	 	Совершенствование структуры имущественных комплексов городских организаций и системы управления государственными унитарными предприятиями, казенными предприятиями и государственными учреждениями.	1. Сокращение числа ГУП и КП до уровня, необходимого для обеспечения решения социально-экономических задач города Москвы. 2. Обеспечение государственных организаций необходимым для осуществления уставной деятельности объемом имущества и контроль за его использованием. 3. Повышение эффективности деятельности ГУП, подлежащих сохранению в указанной организационно-правовой форме, и снижение бюджетной зависимости ГУП. 4. Оптимизация структуры имущества городских организаций. 5. Оптимизация системы управления имуществом, переданным городским организациям, обеспечивающей максимально эффективное решение задач города Москвы.	всего бюджет города Москвы юридические лица федеральный бюджет	1. Повышение эффективности управления путём оптимизации управленческих решений в отношении имущества государственных организаций. 2. Установление системы контроля за эффективностью, законностью использования имущества, переданного государственным организациям на вещных правах, и исполнением управленческих решений. 3. Формирование перечней организаций, подлежащих сохранению в составе имущественного комплекса города Москвы. 4. Повышение конкурентоспособности деятельности ГУП, улучшение финансово-экономических показателей их деятельности путём содействия внутренним преобразованиям в них и прекращению выполнения не свойственных им функций.	2	a41864ea058a41a4a278089d7106a84d	37
70	16Ж	Управление находящимися в городской собственности пакетами акций и долями в уставных капиталах хозяйственных обществ	1	10	 	 	Повышение конкурентоспособности и инвестиционной привлекательности хозяйственных обществ с долей города в уставном капитале и снижение доли участия государства в конкурентных сферах экономики.	1. Оптимизация структуры участия города Москвы в хозяйственных обществах. 2. Увеличение объема налоговых и неналоговых доходов в бюджет города Москвы. 3. Рост капитализации находящихся в государственной собственности города Москвы пакетов акций. 4. Снижение издержек, связанных с управлением хозяйственными обществами с долей города Москвы в уставном капитале. 5. Развитие механизмов государственно-частного партнерства и создание условий для привлечения инвестиционных ресурсов в городское хозяйство, в т.ч. с использованием инструментов финансового рынка. 6. Повышение эффективности деятельности органов управления хозяйственных обществ с долей города в уставном капитале.	всего бюджет города Москвы юридические лица федеральный бюджет	1. Совершенствование существующей системы корпоративного управления хозяйственными обществами с долей города Москвы в уставном капитале. 2. Концентрация усилий на управлении крупными, экономически эффективными и высококапитализированными обществами в жизненно важных для города сферах деятельности. 3. Эффективный контроль финансово-хозяйственной деятельности хозяйственных обществ с долей города Москвы, сохранность городского имущества и предотвращение действий, направленных на нанесение ущерба городу как акционеру. 4. Улучшение всех основных финансовых показателей деятельности обществ с долей города Москвы, увеличение капитализации находящихся в государственной собственности города Москвы пакетов акций. 5. Увеличение уровня налоговых и неналоговых доходов в бюджет города Москвы и дальнейшее повышение капитализации пакетов акций, находящихся в государственной собственности города Москвы. 6. Снижение издержек, связанных с управлением хозяйственными обществами с долей города Москвы в уставном капитале. 7. Привлечение к управлению специализированных управляющих компаний, а также профессионалов в качестве независимых директоров и представителей города в органах управления хозяйственных обществ с долей города в уставном капитале. 8. Привлечение крупнейшими предприятиями с долей города средств для финансирования реализуемых ими инвестиционных проектов и программ посредством размещения ценных бумаг и финансовых инструментов на организованных рынках.	2	1aa773549604408e8d7a0e95b5b3273a	70
100	16А	Инвентаризация территории города Москвы 	1	10	 	 	Получение полной и достоверной информации о землях и земельных участках, составляющих территорию города Москвы, и расположенных на них объектах капитального строительства и некапитальных объектах (в разрезе административно-территориального деления города Москвы).	1. Формирование массива информации о: — землях и земельных участках, права на которые не оформлены или оформлены ненадлежащим образом; — неиспользуемых, неэффективно используемых землях и земельных участках, а также землях и земельных участках, используемых не в соответствии с разрешенным использованием; — свободных от прав третьих лиц землях и земельных участках, потенциально возможных к использованию. 2. Получение информации о расположенных на территории города Москвы технически неучтенных объектах капитального строительства и некапитальных объектах с определением их правовой принадлежности. 3. Выявление и устранение расхождений данных, полученных в результате инвентаризации территории города Москвы, с информацией существующих информационных ресурсов и баз данных. 4. Анализ полученной информации с целью выработки управленческих решений по вовлечению в хозяйственный оборот неучтенных объектов и генерации дополнительных доходов.	всего бюджет города Москвы юридические лица федеральный бюджет	1. Актуализированная информация о земельных участках и объектах капитального строительства, существующих информационных ресурсов и баз данных города Москвы. 2. Массив информации для принятия управленческих решений в отношении выявленных неучтенных и (или) бесхозяйных объектов с целью вовлечения их в хозяйственный оборот. 3. Массив информации об используемых не по целевому назначению объектах, объектах самовольного строительства с целью планирования инспекционных проверок и принятия мер по фактам выявленных нарушений.	2	1a73e60429ff4bbda09f147a636d040b	100
280	16Б	Создание Поземельного реестра — земельного баланса территории города Москвы	1	4	 	 	Создание и актуализация интегрированного публичного информационного ресурса, аккумулирующего сведения о текущем использовании территории города Москвы и повышение эффективности такого использования.	1. Создание информационной карты города Москвы, отражающей существующий и прогнозируемый баланс земель города Москвы в разрезе территориального и функционального использования. 2. Создание базы данных земельных участков, находящихся в собственности и пользовании города Москвы и расположенных за пределами территории города. 3. Систематизация информации о земельных участках и территориях города Москвы по отраслевому и функциональному принципу. 4. Обеспечение постоянной актуализации земельного баланса города Москвы. 5. Обеспечение постоянного контроля за соблюдением правообладателями земельных участков разрешенного использования земельных участков в городе Москве. 6. Информирование граждан и юридических лиц о существующем и прогнозируемом балансе земель на территории города Москвы.	всего бюджет города Москвы юридические лица федеральный бюджет	1. Создание и постоянное поддержание в актуальном состоянии интегрированного публичного информационного ресурса — земельного баланса города Москвы. 2. Обеспечение информационной поддержки принятия управленческих решений в сфере землепользования. 3. Повышение качества принятия управленческих решений в сфере землепользования и сокращения сроков оказания государственных услуг в сфере земельных отношений. 4. Увеличение площади и количества земельных участков с оформленными земельно-правовыми отношениями за счет выявления. 5. Увеличение доходной части бюджета, в том числе за счет вовлечения в оборот поставленных на кадастровый учет сформированных земельных участков. 6. Сокращение числа административных правонарушений в области земельных отношений в городе Москве.	2	31cdfd14f7a940ec81fb3d7d80531835	280
376	16Г	Создание Реестра собственности города Москвы	1	10	 	 	Обеспечение полноты и достоверности информации об объектах собственности города Москвы для реализации государственной политики города Москвы, эффективного управления и распоряжения имуществом.	1. Установление соответствующего правового статуса Реестра собственности города Москвы, обеспечивающего наличие юридически значимой информации. 2. Осуществление межотраслевого взаимодействия органов государственной власти Российской Федерации и города Москвы при разработке и реализации политики города Москвы в сфере имущественно-земельных отношений. 3. Построение системы фиксации использования объектов собственности города Москвы, включая оценку и анализ состояния, а также изменения в составе объектов собственности города Москвы. 4. Принятие обоснованных управленческих решений на основе актуальной информации об объектах собственности города Москвы для социально-экономического развития города Москвы. 5. Вовлечение в гражданско-правовой оборот объектов недвижимого имущества, в том числе ранее неучтенных и выявленных в результате инвентаризации.	всего бюджет города Москвы юридические лица федеральный бюджет	1. Создание структурированного перечня объектов учета, включая основные данные о них. 2. Централизованный учет объектов собственности города Москвы на основе двустороннего использования данных федеральных, городских (отраслевых) информационных систем и ресурсов. 3. Повышение уровня защиты имущественных интересов города Москвы по объектам учета. 4. Администрирование межведомственного информационного ресурса, содержащего сведения об имуществе города Москвы. 5. Наличие достаточного набора сведений о правовых, технических и эксплуатационных характеристиках объектов, в том числе и энергооснащенности, необходимых для эффективного управления и содержания, а также осуществления государственных функций органами исполнительной власти, предприятиями и организациями города Москвы. 6. Межотраслевая координация и контроль за правомерностью использования имущества собственности города Москвы. 7. Повышение эффективности и оптимизация использования объектов собственности города Москвы, обеспечение принятия обоснованных управленческих решений.	2	c5cc4fd22c204cb69a4353cbe9eb30da	376
505	16Д	Управление имуществом города Москвы	1	10	 	 	Формирование эффективной системы управления имуществом, направленной на надлежащее обеспечение государственных функций и снижение доли участия государства в конкурентных сферах экономики.	1. Повышение эффективности и прозрачности управления государственным имуществом. 2. Оптимизация состава имущества, находящегося в городской собственности, в т.ч. путем перераспределения имущества, направленного на: — обеспечение имущественной основы деятельности государственных органов власти и организаций с учетом установленных требований; — получение доходов в бюджет города Москвы на основе эффективного управления государственной собственностью. 2. Улучшение инвестиционного климата в городе Москве в установленной сфере деятельности. 3. Стимулирование развития различных форм государственно-частного партнерства. 4. Обеспечение экономической эффективности процесса приватизации имущества города Москвы. 5. Формирование эффективной системы использования объектов недвижимости, находящихся в собственности города Москвы и являющихся объектами культурного наследия	всего бюджет города Москвы юридические лица федеральный бюджет	1. Оптимальная структура и состав собственности города: — оптимизация расходов на содержание имущества; — обеспечение имущественной основы деятельности государственных органов власти и организаций. 2. Повышение эффективности использования городского имущества, в т.ч. увеличение доходов, поступающих в бюджет города Москвы. 3. Сокращение масштабов использования принадлежащего городу имущества в коммерческих целях. 4. Обеспечение соблюдения требований по использованию объектов недвижимости, установленных федеральным законодательством и правовыми актами города Москвы, 5. Повышение ликвидности и качественных характеристик объектов недвижимого имущества города Москвы за счет проведения капитального ремонта объектов.	2	0b77ef2b2e714af6a64874fc3a444ffa	505
