Key	Code	Name	GovProgram_Id	ResponsibleFOIV_Id	ResponsibleForInput_Id	Instruments	Goals	Tasks	FinancingSources	Results	Element_Id	FullName	StatusName	Id	ord	Executor	StartDate	EndDate
316	04В	Социальная интеграция  инвалидов и формирование безбарьерной среды для инвалидов и других маломобильных групп населения	1	7	 	 	Обеспечение равных возможностей во всех сферах жизнедеятельности для инвалидов и других маломобильных групп населения 	1. Повышение эффективности оказания реабелитационных услуг; 2. Повышение доступности объектов  городской инфраструктуры и рынка труда для инвалидови других маломобильных групп населения;	всего бюджет города Москвы юридические лица федеральный бюджет	 	2	612a6c584d704772a4a0473682a71bbb	316
378	04Б	Социальная поддержка старшего поколения, ветеранов Великой Отечественной войны, ветеранов боевых действий и членов их семей	1	7	 	 	Формирование комфортных условий жизни и активного долголетия старшего поколения 	1. Повышение уровня материального обеспечения пенсионеров; 2. Увеличение  охвата социальными услугами граждан старшего поколения;	всего бюджет города Москвы юридические лица федеральный бюджет	 	2	262bb2c500b942439bc253f4e47a2cb8	378
430	04Д	Модернизация и развитие системы социальной защиты населения города Москвы	1	7	 	 	 	 	всего бюджет города Москвы юридические лица федеральный бюджет	 	2	924cb47d0b024e08ad8b60f1f015e5b8	430
585	04Г	Профилактика социальной исключенности	1	7	 	 	Преодоление социального сиротства и крайних форм проявления бедности	1.Развитие семейных форм устройства и сопровождения  детей-сирот и детей, оставшихся без попечения родителей; 2. Профилактика и преодоление  крайних форм  проявления бедности и социальной исключенности; 3. Эпизоотическое и ветеринарно-санитарное благополучие;	всего бюджет города Москвы юридические лица федеральный бюджет	 	2	f150cbad6e674345871387f68bd91ae0	585
672	04А	Социальная поддержка семей с детьми	1	7	 	 	Создание условий для социальной и экономической устойчивости семьи	1. Сокращение уровня бедности среди семей с детьми, нуждающихся в социальной поддержке; 2. Развитие адресной социальной помощи для семей с детьми.	всего бюджет города Москвы юридические лица федеральный бюджет	 	2	826737efc23b4d3b98c299bd8d5bebc2	672
