0_OBJECTID;0_UIDNFTN;0_Код;0_АС УР OLD_ID;0_Наименование объекта;1_Адресный ориентир;1_Стоимость посещения;0_Координата X;0_Координата Y;0_УНОМ БТИ;0_ID спортивной зоны/зоны отдыха;0_Тип спортивной зоны/зоны отдыха;0_Название спортивной зоны/зоны отдыха;1_Наличие проката оборудования и инвентаря (да/нет);1_Время работы;1_Тип покрытия;1_Освещение;1_Наличие бесплатных занятий (да/нет);1_Стоимость проката оборудования и инвентаря (указать наименование);0_Уточненные координаты (широта);0_Уточненные координаты  (долгота);0_ID объекта;0_Тип объекта;1_Ведомственная принадлежность;1_Округ;1_Район;1_Наличие сервиса технического обслуживания инвентаря (да/нет);1_Наличие раздевалки (да/нет);1_Наличие звукового сопровождения (да/нет);1_Наличие точки питания (да/нет);1_Наличие туалета (да/нет);1_Наличие точки доступа в интернет, Wi-Fi (да/нет);1_Наличие банкомата (да/нет);1_Наличие медпункта (да/нет);1_ОГРН эксплуатирующей организации;1_Наименование эксплуатирующей организации, предоставляющей услугу по спортивной зоне/зоне объекта;1_Телефон эксплуатирующей организации;1_Сайт эксплуатирующей организации;1_Электронная почта эксплуатирующей организации;0_Статус;0_Комментарии
1;4720;4720;MSPORT100;Государственное бюджетное учреждение дополнительного образования детей спортивной направленности города Москвы «Специализированная Детско-юношеская спортивная школа олимпийского резерва «Северный» Департамента физической культуры и спорта города Москвы;9-я Северная линия 1Б;только для учащихся;3506,4749;30062,0673;;106909;поле конно-спортивное для конкура и выездки;;нет;Понедельник с 8:00 до 23:00 Вторник с 8:00 до 23:00 Среда с 8:00 до 23:00 Четверг с 8:00 до 23:00 Пятница с 8:00 до 23:00 Суббота с 8:00 до 23:00 Воскресенье с 8:00 до 23:00;отсыпное;смешанное освещение;да;нет;55.93701871105022;37.55432921187783;39815;учреждения (центры) дополнительного образования;Департамент физической культуры и спорта города Москвы;СВАО;Северный;нет;да;да;да;да;нет;нет;да;1037739219319;"Государственное бюджетное образовательное учреждение дополнительного образования детей спортивной направленности города Москвы ""Специализированная детско-юношеская спортивная школа олимпийского резерва ""Северный"" Департамента физической культуры и спорта";(499) 767-89-16;severny.mossport.ru;severny@mossport.ru;внесены изменения;
2;532;532;DK____216;"Конный Клуб ""Золотая подкова""";Кузьминский парк, д.1 стр.2;сведения отсутствуют;18301,048;2467,3479;0;0;поле конно-спортивное для конкура и выездки;;нет;10:00-19:00;песчаное;лампы дневного освещения;нет;нет;;;0;конно-спортивные базы;Департамент культуры города Москвы;ЮВАО;Кузьминки;нет;да;нет;нет;нет;нет;нет;нет;1027739424514;ГАУК г.Москвы «Парк культуры и отдыха «Кузьминки»;(499) 175-33-69;www.kuzminky.ru;kyzay07@yandex.ru;Подтверждено;
3;4673;4673;MSPORT53;"Конно-спортивная база государственного бюджетного образовательного учреждения дополнительного образования детей спортивной направленности физкультурно-спортивного общества ""Юность Москвы""";ул. Заречье 7;сведения отсутствуют;17445,0032;2388,8684;;106010;поле конно-спортивное для конкура и выездки;;нет;Понедельник с 10:00 до 19:00 Вторник с 10:00 до 19:00 Среда с 10:00 до 19:00 Четверг с 10:00 до 19:00 Пятница с 10:00 до 19:00 Суббота с 10:00 до 19:00 Воскресенье с до;отсыпное;без освещения;да;нет;55.68922747368429;37.77433753466087;39589;конно-спортивные базы;Департамент физической культуры и спорта города Москвы;ЮВАО;Люблино;нет;нет;нет;нет;да;да;нет;да;1037739076880;"Государственное бюджетное образовательное учреждение дополнительного образования детей спортивной направленности города Москвы ""Специализированная детско-юношеская спортивная школа олимпийского резерва ""Физкультурно-спортивное объединение ""Юность Москвы""";(495) 950-55-94;ynmoscow.ru;fso.yum@mossport.ru;внесены изменения;
4;423;423;DK____107;конно-спортивный оздоровительный центр ЦПКиО им. Горького;ул. Крымский вал, д.9;800;5141,5407;5146,674;0;0;поле конно-спортивное для конкура и выездки;;да;10.00-23.00;грунтовое;уличные столбы освещения;да;сведения отсутствуют;;;0;плоскостные спортивные сооружения;Департамент культуры города Москвы;ЦАО;Якиманка;да;да;нет;да;да;да;нет;нет;1027739258249;ГАУК г.Москвы ЦПКиО им.М.Горького;(495) 995-00-20;park-gorkogo.com;official@park-gorkogo.com;Подтверждено;
5;5;;;КСК «Измайлово»;шоссе Энтуазистов, д.31в;сведения отсутствуют;16106,5753;10513,666;;;поле конно-спортивное для конкура и выездки;КСК «Измайлово»;да;10:00-21:00;грунтовое;без освещения;нет;сведения отсутствуют;;;;конно-спортивные базы;частная;ВАО;Измайлово;нет;да;да;да;да;нет;нет;да;сведений нет;сведения отсутствуют;(495) 517-43-82;www.kskizmailovo.ru;koni@kskizmailovo.ru;;
6;6;;;Конно-спортивная база ЦСКА;ул. Дыбенко, д. 5;сведения отсутствуют;-996,9169;22676,7197;;;поле конно-спортивное для конкура и выездки;Конно-спортивная база ЦСКА;да;10:00-22:00;грунтовое;прожекторное освещение;нет;сведения отсутствуют;;;;конно-спортивные базы;сведения отсутствуют;САО;Ховрино;да;да;да;да;да;да;нет;нет;сведений нет;сведения отсутствуют;(495) 451-07-05;www.cska.ru;cskainfo@cska.ru;;
