0_OBJECTID;0_UIDNFTN;0_Код;0_АС УР OLD_ID;0_Наименование объекта;1_Адресный ориентир;1_Стоимость посещения;0_Координата X;0_Координата Y;0_УНОМ БТИ;0_ID спортивной зоны/зоны отдыха;0_Тип спортивной зоны/зоны отдыха;0_Название спортивной зоны/зоны отдыха;1_Наличие проката оборудования и инвентаря (да/нет);1_Время работы;1_Тип покрытия;1_Освещение;1_Наличие бесплатных занятий (да/нет);1_Стоимость проката оборудования и инвентаря (указать наименование);0_Уточненные координаты (широта);0_Уточненные координаты  (долгота);0_ID объекта;0_Тип объекта;1_Ведомственная принадлежность;1_Округ;1_Район;1_Наличие сервиса технического обслуживания инвентаря (да/нет);1_Наличие раздевалки (да/нет);1_Наличие звукового сопровождения (да/нет);1_Наличие точки питания (да/нет);1_Наличие туалета (да/нет);1_Наличие точки доступа в интернет, Wi-Fi (да/нет);1_Наличие банкомата (да/нет);1_Наличие медпункта (да/нет);1_ОГРН эксплуатирующей организации;1_Наименование эксплуатирующей организации, предоставляющей услугу по спортивной зоне/зоне объекта;1_Телефон эксплуатирующей организации;1_Сайт эксплуатирующей организации;1_Электронная почта эксплуатирующей организации;0_Статус;0_Комментарии
1;431;431;DK____115;лодочная станция;Народный пр-т, д.17;сведения отсутствуют;15941,382;11795,6972;0;0;лодочная станция;;да;"будни с 12:00 до 20:00; вых. с 11:00 до 21:00";специальное;смешанное освещение;нет;"200 руб./час - 2-х местный катамаран; 300 руб./час - 4-х местный катамаран; 300 руб./час - лодка";;;0;гребные базы и каналы;Департамент культуры города Москвы;ВАО;Измайлово;да;нет;да;нет;нет;да;нет;нет;1037739542719;"ГАУК г. Москвы ""Измайловский ПКиО""";(499) 166-61-19;www.izmailovsky-park.ru;izmpark@mail.ru;Подтверждено;
2;555;555;DK____239;"территория вблизи водоема для проката лодок, катамаранов и т.д. ГБУК г Москвы ""ГМЗ ""Царицыно""";ул. Дольская, вл. 1.;сведения отсутствуют;11233,956;-5240,5418;0;0;лодочная станция;территория вблизи водоема для проката лодок, катамаранов и т.д.;да;с 12:00 до 22:00;специальное;без освещения;нет;сведения отсутствуют;;;0;гребные базы и каналы;Департамент культуры города Москвы;ЮАО;Бирюлёво Восточное;да;нет;да;нет;да;нет;нет;нет;1027739504792;"ГБУК г. Москвы ""ГМЗ ""Царицыно""";(495) 321-63-66;www.tsaritsyno.net;gmz@tsaritsyno.net;Подтверждено;
3;503;503;DK____187;Государственный музей керамики и «Усадьба Кусково XVIII века»;ул. Юности д. 2;сведения отсутствуют;19237,2867;7729,6121;2121968;0;лодочная станция;;да;с 10:00 до 20:00;деревянное;без освещения;да;200 руб. - лодки;;;0;гребные базы и каналы;Департамент культуры города Москвы;ВАО;Вешняки;нет;нет;нет;нет;да;нет;нет;нет;1027739430091;ГБУК г.Москвы «Государственный музей керамики и «Усадьба Кусково XVIII века»;(495) 370-01-50;kuskovo.ru;museum@kuskovo.ru;Подтверждено;
4;533;533;DK____217;лодочная станция ПКиО Кузьминки;Кузьминский парк, д.1 стр.2;сведения отсутствуют;17326,0565;2792,1246;0;0;лодочная станция;;да;с 09:00 до 22:00;деревянное;прожекторное освещение;нет;350 руб./час - лодки, катамараны;;;0;гребные базы и каналы;Департамент культуры города Москвы;ЮВАО;Кузьминки;да;нет;нет;нет;нет;нет;нет;нет;1027739424514;ГАУК г.Москвы «Парк культуры и отдыха «Кузьминки»;(499) 175-33-69;www.kuzminky.ru;kyzay07@yandex.ru;Подтверждено;
5;468;468;DK____152;"2 лодочные станции ""Голицынский пруд"" ""Пионерский пруд""";ул. Крымский вал, д.9;"депозит - 500 руб.; 2-х местный катамаран - 200 руб./час; 4-х местный катамаран - 350 руб.; прокат лодок - 350 руб./час";6208,8719;6435,5943;0;0;лодочная станция;;да;с 10:00 до 22:00;специальное;уличные столбы освещения;да;200 руб. - 350 руб. - катамараны, лодки;;;0;парки (озелененные городские территории);Департамент культуры города Москвы;ЦАО;Якиманка;да;нет;нет;да;да;да;нет;да;1027739258249;ГАУК г.Москвы ЦПКиО им.М.Горького;(495) 140-86-61;grebnoy-kanal.ru;info@grebnoy-kanal.ru;Подтверждено;
