Key	Code	Name	GovProgram_Id	ResponsibleFOIV_Id	ResponsibleForInput_Id	Instruments	Goals	Tasks	FinancingSources	Results	Element_Id	FullName	StatusName	Id	ord	Executor	StartDate	EndDate
129	06А	Развитие электроснабжения города Москвы	1	1	 	 	Повышение надежности, доступности электросетевой инфраструктуры и качества оказываемых услуг	— предотвращение критического уровня износа объектов системы; — снижение потерь в электрических сетях при передаче электрической энергии; — снижение издержек на эксплуатацию действующей электрической сети; — повышение качества передачи электрической энергии; — разработка и реализация программы реновации оборудования, выработавшего установленные сроки службы; — увеличение доли телемеханизированных подстанций; — увеличение протяженности кабельных линий электропередачи и воздушных линий с использованием самонесущих изолированных проводов; — ликвидация дефицита трансформаторной мощности путем строительства новых центров питания; — обеспечение надежности электроснабжения за счет строительства новых кабельных линий 110 кВ и 220 кВ; — развитие распределительной сети 20 кВ; — строительство новых блоков на основе современных, в том числе парогазовых технологий 	всего бюджет города Москвы юридические лица федеральный бюджет	— Протяженность строительства кабельных линий напряжением 0,4—35 кВ с 2012 по 2016 г. составит 3343,07 км; — Протяженность строительства кабельных линий напряжением 110 кВ и 220 кВ с 2012 по 2016 г. составит 235,6 км; — Объем строительства и реконструкции новых распределительных пунктов составит 541 шт. к 2016 г.; — Объем строительства и реконструкции центров питания (ПС 110 кВ и выше) составит 38 шт. к 2016 г.; — Протяженность реконструкции кабельных линий напряжением 0,4—35 кВ с 2012 по 2016 г. составит 670 км; — Протяженность реконструкции кабельных линий напряжением 110 кВ и 220 кВ с 2012 по 2016 г. составит 344 км; — Сокращение потерь в электрической энергии в распределительных сетях достигнет уровня 9,9% в 2016 г.; — Завершение строительства ПГУ-420 на ТЭЦ-16, ТЭЦ-20 в 2013 г. и на ТЭЦ-12 к 2014 г. 	2	f9b47f2cd9b64c55ba441ad44ab41d5b	129
175	06Б	Развитие теплоснабжения города Москвы	1	1	 	 	Разработка надежного, экономически эффективного и экологически приемлемого варианта теплоснабжения города Москвы	— Определение прогнозных тепловых нагрузок по районам и городу в целом на рассматриваемую перспективу; — Определение перспектив развития ТЭЦ, РТС, и ГТЭС мощностью более 100 Гкал/ч с размещением нового оборудования на схемах генеральных планов; — Формирование зон действия теплоисточников; — Определение основных характеристик тепловых сетей города; — Подготовка и согласование сводных пакетов инвестиционных предложений нового строительства и реконструкции теплоисточников и тепловых сетей; — Обеспечение устойчивого развития города Москвы за счет эффективного использования энергетических и финансовых ресурсов в развитии объектов теплового хозяйства города Москвы при стабилизации к 2016 году существующих годовых расходов топлива на производство тепла и электроэнергии в городе 	всего бюджет города Москвы юридические лица федеральный бюджет	Новое строительство и реконструкция в рамках развития системы теплоснабжения к 2016 г. составит 1 528,411 км; Снижение количества повреждений на разводящих сетях на 1 км тепловой сети с 0,092 ед./1км в 2011 г. до 0,08 ед./1км в 2016 г.; Сокращение количества повреждений на магистральных сетях на 1 км тепловой сети с 1,18 ед./1км в 2011 г. до 0,4 ед./1км в 2016 г.; Снижения уровня потерь тепловой энергии на разводящих сетях с 0,037 Гкал/км в 2011 г. до 0,034 Гкал/км в 2016 г.; Сокращение уровня потерь тепловой энергии на магистральных сетях с 0,027 Гкал/км в 2011 г. до 0,22 Гкал/км в 2016 г.; Снижение износа магистральных сетей с 58,2% в 2011 г. до 43,5% в 2016 г.; Сокращение износа разводящих сетей с 43,85% в 2011 г. до 42,1% в 2016 г. 	2	9424c08983e14efda71e24b9a88ca959	175
277	06Д	Развитие и модернизация водопроводно-канализационного хозяйства и систем технического водоснабжения города Москвы	1	25	 	 	 Обеспечение удовлетворения потребностей жителей и организаций города Москвы в услугах водоснабжения и канализации в соответствии с установленными нормативами качества	Создание новых и модернизация имеющихся производственных мощностей;   Уменьшение среднего уровня износа коммунальной инфраструктуры; водопроводно-канализационного хозяйства и систем технического водоснабжения;  Уменьшение себестоимости услуг водопроводно-канализационного хозяйства и систем технического водоснабжения	всего бюджет города Москвы юридические лица федеральный бюджет	Реализация государственной подпрограммы позволит: — сохранить существующий уровень обеспеченности населения централизованными услугами водоснабжения и водоотведения; — довести до 0% долю не отвечающих гигиеническим нормативам по санитарно-химическим показателям проб воды в водопроводных сетях города Москвы; — уменьшить интенсивность отказов на водопроводных и канализационных сетях на 10—15%; — сократить величину неучтенных расходов и потерь воды, от общего объема, поданного в сеть хозяйственно-питьевого водопровода, на 20—25%; — увеличить долю применения технической воды для полива городских территорий на 100%; — ввести в эксплуатацию станции водоподготовки, переведенные на гипохлорит натрия, — Северную, Восточную и Рублевскую мощностью 5000 тыс. куб. м/сут.; — ввести в эксплуатацию озоносорбционные блоки и технологии озонирования на Рублевской станции водоподготовки мощностью 320 тыс. куб. м/сут.; — Ввести в эксплуатацию Юго-западные, Зеленоградские, Курьяновские и Люберецкие очистные сооружения мощностью 4655 тыс. куб. м/сут	2	f65c911a584d4056910d3b182336e731	277
411	06И	Развитие инженерных коммуникаций города Москвы	1	34	 	 	Обеспечение надежным тепло, водо и электроснабжением существующих и строящихся объектов застройки города Москвы.	Прокладка около 1350 км инженерных сетей различного назначения (водопроводов, канализационных коллекторов, тепловых и газовых сетей, кабельных коллекторов и кабельных линий).	всего бюджет города Москвы юридические лица федеральный бюджет	Строительство и ввод жилья за счет средств городского бюджета общей площадью 553,2 кв.м. в 2012 году Строительство и ввод жилья за счет средств городского бюджета общей площадью 789,9 кв.м. в 2013 году Строительство и ввод жилья за счет средств городского бюджета общей площадью 760,0 кв.м. в 2014 году Строительство и ввод жилья за счет средств городского бюджета общей площадью 836,0 кв.м. в 2015 году Строительство и ввод жилья за счет средств городского бюджета общей площадью 919,6 кв.м. в 2016 году	2	16250d3f79e34339a32d5ce00cf65248	411
544	06Г	Развитие и модернизация объектов коллекторного хозяйства города Москвы	1	25	 	 	Создание инфраструктуры для прокладки и технической эксплуатации городских инженерных коммуникаций; Обеспечение комфортных условий для проживания жителей города Москвы; Обеспечение качества и доступности услуг потребителям по технической эксплуатации коммуникационных коллекторов	обеспечение надежного безаварийного функционирования коллекторного хозяйства города Москвы; обеспечение условий для развития инженерной инфраструктуры городского хозяйства; повышение безопасности, антитеррористической защищенности объектов инженерной инфраструктуры	всего бюджет города Москвы юридические лица федеральный бюджет	Строительство кабельных коллекторов к 2016 г. составит 16,59 км; Строительство производственной базы по улице Лобачика; Реконструкция коммуникационных коллекторов к 2016 г. составит 79,74 км; Сокращение износа к 2016 г. составит 3%; Техническое перевооружение инженерных сетей и оборудования составит 333,1 км / 118 ед.оборудования к 2016 г.	2	d6dc3156d8834e38845b7e75374a3bee	544
823	06Ж	Развитие единой светоцветовой среды города Москвы	1	1	 	 	1.	Обеспечение условий комфортного и безопасного проживания в городе в соответствии с современными требованиями; 2.	Повышение эффективности и надежности работы установок наружного освещения, архитектурно-художественной подсветки и праздничного оформления города; 3.	Снижение показателей энергопотребления в установках наружного, архитектурно-художественного освещения и праздничного оформления города за счет применения энергосберегающих технологий; 4.	Обеспечение экономии средств городского бюджета за счет снижения эксплуатационных расходов в результате применения современных технологий и материалов	. Приведение наружного, архитектурно-художественного освещения и праздничного оформления города в соответствие с нормативными требованиями; 2. Сокращение количества отказов в работе установок наружного освещения, архитектурно-художественной подсветки и праздничного оформления города; 3. Улучшение архитектурно-художественных качеств световой среды города в вечерне-ночное время в соответствии с концепцией единой световой среды; 4. Модернизация оборудования на основе современных технологий	всего бюджет города Москвы юридические лица федеральный бюджет	Создание единой светоцветовой среды, сочетающей все виды освещения — наружного, архитектурно-художественного и праздничного, обеспечивающей единое, целостное восприятие общественных зон, социальных объектов, дворовых территорий, магистралей водителями и пешеходами как в повседневном, так и в праздничном режимах;  увеличение интенсивности движения автотранспорта, повышение экологической безопасности, снижение ослепленности и дискомфорта водителей и пешеходов; снижение уличной преступности, количества дорожно-транспортных происшествий, травматизма пешеходов, и, как следствие, уменьшение расходов бюджета на восстановление здоровья пострадавших горожан и на их социальное обеспечение; Сокращение затрат на энергопотребление и содержание наружного, архитектурно-художественного и праздничного освещения за счет применения современных технологий и материалов 	2	9bdf2d0678834c6a8cb2c11c5d402edb	823
828	06Е	Развитие и модернизация объектов водоотведения поверхностного стока города Москвы	1	25	 	 	Повышение качества и доступности услуг водоотведения поверхностного стока	— Создание новых и модернизация имеющихся мощностей; — Уменьшение среднего уровня износа коммунальной инфраструктуры водоотведения поверхностного стока; — Уменьшение себестоимости услуг водоотведения поверхностного стока; — Повышение уровня благоустройства объектов поверхностного стока	всего бюджет города Москвы юридические лица федеральный бюджет	Доля площади города, обеспеченного сетями водостока, к 2016 г. составит 91,6%; Объем ремонта сетей водостока к 2016 г. составит 271,85 км; Количество аварий и инцидентов на 1 км сетей водостока к 2016 г. составит 95,7% от уровня 2008 г.; Интенсивность отказов на водосточных сетях к 2016 г. составит 0,12 ав./г.км; Доля сточных вод, очищенных до нормативных значений, в общем объеме сточных вод, пропущенных через очистные сооружения, к 2016 г. составит 75%	2	6630544660134a5f9287c29e202d86b6	828
908	06З	Развитие сети общественных туалетов города Москвы	1	25	 	 	Обеспечение условий комфортного и безопасного проживания в городе в соответствии с современными требованиями; Повышение эффективности и надежности работы общественных туалетов; Снижение показателей энергопотребления в общественных туалетах за счет применения энергосберегающих технологий; Обеспечение экономии средств городского бюджета за счет снижения эксплуатационных расходов в результате применения современных технологий и материалов	Капитальный ремонт и модернизация существующих общественных туалетов; Расширение сети общественных туалетов г. Москвы; Обеспечение доступности услуги, в том числе для маломобильных групп населения; Улучшение информирования населения о местах размещения общественных туалетов; Внедрение новых технологий, в том числе обеспечивающих решения по энергосбережению и антитеррористической защищенности граждан	всего бюджет города Москвы юридические лица федеральный бюджет	— Увеличение количества общественных туалетов в г. Москве; — Повышение качества оказания услуг в сфере обслуживания населения; — Обеспечение экономии средств городского бюджета за счет снижения эксплуатационных расходов; — Улучшение архитектурного облика объектов городской инфраструктуры;  — Повышение комфортности проживания в городе, в том числе для маломобильных групп населения; — Размещение передвижных туалетных модулей — 836 ед. к 2016 г.	2	c51f53525dbc48dca3c4d6902602683a	908
915	06В	Развитие газоснабжения города Москвы	1	1	 	 	Повышение уровня безопасности и комфорта жизни жителей города Москвы; Обеспечение надежной и безопасной эксплуатации газораспределительной системы города; Формирование сбалансированной программы проектирования и строительства газопроводов и объектов газораспределительной системы на территории города Москвы	Обеспечение безаварийного и бесперебойного снабжения газом объектов энергетики, промышленности, городского хозяйства и населения; Сокращение числа объектов газораспределительной системы с предельными сроками эксплуатации; Сокращение протяженности подземных газопроводов, не защищенных от коррозии; Повышение энергоэффективности функционирования газораспределительной системы; Снижение издержек на эксплуатацию газораспределительной системы	всего бюджет города Москвы юридические лица федеральный бюджет	Реконструкция газопроводов составит 356,7 км.; Реконструкция ГРП составит 49 шт.; Реконструкция ЭЗУ составит 620 шт.; Строительство новых ЭЗУ составит 75 шт.; Количество инцидентов на 100 км подземных и надземных газопроводов составит 0,69 ед./100 км.	2	d69929b51e224a429937d84d13fec11a	915
