Key	Code	Name	GovProgram_Id	ResponsibleFOIV_Id	ResponsibleForInput_Id	Instruments	Goals	Tasks	FinancingSources	Results	Element_Id	FullName	StatusName	Id	ord	Executor	StartDate	EndDate
205	13А	Индустрия отдыха и туризма на территориях парков культуры и отдыха, музеев-заповедников и музеев-усадеб	1	3	 	 	Устойчивое и эффективное развитие парков, повышение их социальной, экологической, архитектурно-ландшафтной значимости, создание максимально благоприятных условий для саморазвития подрастающего поколения,  предоставления полного спектра качественных услуг. Развитие инфраструктуры территорий музеев-усадеб и музеев-заповедников в части улучшения качества и количества услуг, оказываемых населению: общественное питание, продажа сувенирной и книжно-издательской продукции, развитие активного семейного и оздоровительного отдыха и других услуг на территориях парков и  музеев.	1.Развитие разнообразных видов культурных и досуговых услуг с учетом дифференцированного подхода к разным группам их потребителей.  2.Восстановление и сохранение природных, исторических комплексов, парковых объектов, их специализация по разным видам культурно-досуговой деятельности, развитие всесезонных форм работы с посетителями.  3.Увеличение  собственных доходов учреждений. 4. Развитие дополнительных услуг, оказываемых населению учреждениями. 5. Увеличение числа посетителей.  6. Оптимизация сочетания долей бюджетного и внебюджетного финансирования, создание условий для привлечения инвестиций, развития частно-государственного партнерства.	всего бюджет города Москвы юридические лица федеральный бюджет	Реализация подпрограммы  позволит: -	Увеличить число услуг, оказываемых посетителям парков культуры и отдыха, и расширить спектр культурно-массовых, спортивно-оздоровительных, эколого-просветительских и иных мероприятий в 4,3 раза (от уровня 2010 г). -	Увеличить  количество и объем представляемых посетителям услуг на территориях музеев-заповедников и музеев-усадеб в 4,2 раза (от уровня 2010 г). -	Увеличить  посещаемость парков культуры и отдыха, музеев-заповедников и музеев-усадеб в среднем в  2 раза, детских парков в 1,4 раза (от уровня 2010 г). -	Обеспечить ежегодное комплексное благоустройство территорий  парков культуры и отдыха (капитальный ремонт и содержание зеленых насаждений). -	Реализовать мероприятия по развитию материально-технической базы парков (ремонт и реставрация памятников, капитальный ремонт зданий и помещений). -	Провести мероприятия по реставрации московских усадеб и создание на их базе современных музейных рекреационных комплексов. -	Увеличить  долю собственных доходов по отношению к финансированию из бюджета города Москвы в парках культуры и отдыха до 85%, в музеях-усадьбах и музеях-заповедниках до 13%. -	Создать  условия для привлечения  внебюджетных ресурсов в развитие  инфраструктуры отдыха и досуга.	2	d8893b4d983b499aa3532b52d3220ded	205
208	13Д	Развитие туризма	1	22	 	 	Создание благоприятных условий для посещения города Москвы российскими и иностранными гражданами с туристскими целями, повышение конкурентоспособности туристско-гостиничного комплекса города Москвы	Совершенствование нормативной правовой базы в области развития туризма, развитие туристской инфраструктуры, повышение качества обслуживания, расширение ассортимента туристского продукта, совершенствование подготовки кадров, обеспечение безопасности туризма, продвижение туристского продукта города Москвы на внутреннем и внешнем рынках, мониторинг развития туристского рынка города Москвы и эффективности его регулирования.	всего бюджет города Москвы юридические лица федеральный бюджет	Реализация подпрограммы позволит: -	увеличить число международных прибытий туристов в город Москву; -	увеличить численность размещенных лиц в гостиницах и аналогичных средствах размещения;   -	увеличить количество номеров в гостиницах и аналогичных средствах размещения  -	увеличить среднесписочную численность работников, занятых в гостиницах и аналогичных средствах размещения;  -	увеличить доходы от предоставляемых услуг гостиницами и аналогичными средствами размещения; -	увеличить объем платных туристских услуг. 	2	7cc0aac47797427cbf682c0e76264897	208
335	13В	Развитие объектов в жилом секторе	1	25	 	 	Создание условий организации современного и комфортного отдыха населения города Москвы по месту жительства.	Увеличение количества и улучшение качественного состояния дворовых территорий, включая детские площадки,  площадки для выгула домашних животных и тихого отдыха,  используемых для отдыха населения города Москвы по месту жительства.	всего бюджет города Москвы юридические лица федеральный бюджет	Реализация подпрограммы позволит  -	Увеличить количество и повысить качество существующих объектов отдыха в жилом секторе -	Увеличить долю населения города Москвы, вовлеченного в организованные формы отдыха по месту жительства. -	Обустроить дворовые территории.  	2	66ec9ec0172a48c3b5dc4b8f2e32aa87	335
446	13Б	Индустрия отдыха  на озелененных территориях  общего пользования	1	25	 	 	Повышение уровня благоустройства городских озелененных территорий I и II категорий. Приспособление парков, парковых зон, скверов и бульваров к организации отдыха и досуга жителей и гостей города Москвы. Повышение привлекательности парков, парковых зон, скверов и бульваров для инвесторов с целью организации в них комплекса услуг для развития индустрии отдыха.	Обеспечить благоустройство парков и парковых зон, скверов и бульваров города Москвы, развитие их инфраструктуры с целью создания условий для повышения привлекательности в качестве объектов досуга и отдыха жителей и гостей города Москвы.	всего бюджет города Москвы юридические лица федеральный бюджет	Реализация подпрограммы позволит: - создать условия  и повысить качество, привлекательности  и доступности  услуг в сфере здорового и культурного отдыха жителей и гостей города Москвы, в том числе путем развития парков, скверов, бульваров и озелененных территорий с целью увеличения разнообразия  культурно-досуговых услуг и повышения экологической культуры населения. - увеличить количество посетителей, проводящих досуг в парках, парковых зонах, бульварах, скверах и на благоустроенных водных объектах в составе озелененных территорий к 2016 году в 2,6 раза от уровня 2010 года. - увеличить количество водных объектов в составе озелененных территорий, благоустроенных для проведения отдыха граждан с 4 объектов в 2012 году до 29 объектов в 2016 г.  - доля благоустроенных территорий парков, парковых зон, бульваров и скверов к их общей площади по уровню 2011 года составит к 2016 году 100%.	2	76e34b7c8d4c4a59b018649406132119	446
955	13Г	Индустрия отдыха на спортивных территориях и объектах	1	11	 	 	Формирование осознанной необходимости у населения заниматься физической культурой и спортом для укрепления здоровья и реализации себя как личности. Повышение интереса различных категорий населения к занятиям физической культурой и спортом. Создание условий для занятий физической культурой и спортом, укрепления физического и нравственного здоровья жителей города Москвы. Расширение возможностей для физкультурно-оздоровительных занятий населения города Москвы по месту жительства.	Развитие спортивных сооружений Москомспорта на территории жилых микрорайонов. Развитие спортивных объектов Москомспорта, находящихся в непосредственной близости к территориям парков, лесопарков, зон отдыха. Развитие материально-технической базы учреждений Москомспорта. Укрепление материально технической базы и улучшение качества спортивных площадок, переданных в ведение органов местного самоуправления  внутригородских муниципальных образований для организации физкультурно-оздоровительной и спортивной работы с населением города Москвы по месту жительства.	всего бюджет города Москвы юридические лица федеральный бюджет	Реализация подпрограммы  позволит: –  оказать содействие в достижении целевых показателей Государственной программы города Москвы «Спорт Москвы» на 2012-2016 гг.»; –  повысить качество и количество предоставляемых спортивных услуг; –  привлечь к занятиям физкультурой детей и молодежь, что будет способствовать повышению уровня здоровья жителей города Москвы; –  повысить эффективность использования территорий парков, лесопарков, зон отдыха для целей физической культуры и спорта; –  увеличить удельный вес спортивных площадок, используемых для отдыха, организации физкультурно-оздоровительной и спортивной работы с населением города Москвы по месту жительства, соответствующих утвержденным требованиям, до 100%.	2	3aef7ec6fd2f49389ed0e1a8c973c656	955
964	13Ж	Развитие перспективных и новых территорий	1	20	 	 	Разработка предложений по направлениям развития городских парков, природно-рекреационных территорий, зон отдыха и досуга для привлечения инвесторов (далее также – градостроительные предпосылки).	Подготовка предложений по развитию парков и других рекреационных территорий города Москвы, обеспечивающих повышение эффективности предоставляемых рекреационных услуг на существующих объектах и планированию новых объектов рекреационного обслуживания на основании решений, принятых в Генеральном плане города Москвы, с уче-том спроса населения и законодательно установленных ограничений по использованию территорий.	всего бюджет города Москвы юридические лица федеральный бюджет	Реализация подпрограммы позволит подготовить документацию и провести работы, необходимые для создания градо-строительных предпосылок развития новых и перспективных территорий; позволит создать условия для формирования предложений по направлениям развития территорий для привлечения инвесторов.	2	302fe1aec7d44dcc9b00e3dcad57ff77	964
974	13Е	Обеспечение безопасности на водных объектах в зонах отдыха	1	34	 	 	Обеспечение безопасности людей на водных объектах, расположенных в зонах отдыха. Совершенствование системы предупреждения несчастных случаев на воде, развитие поисково-спасательных сил города, организация спасения пострадавших.	- Формирование и реализации комплекса  материально-технических мер по обеспечение безопасности на водных объектах в зонах отдыха жителей города Москвы. - Улучшение взаимодействия и координации действий органов исполнительной власти города Москвы в решении проблемных ситуаций, связанных с обеспечением безопасности на водных объектах в зонах отдыха города Москвы и четкого распределения полномочий и ответственности между органами исполнительной власти города Москвы при решении отдельных задач в границах своей компетентности.	всего бюджет города Москвы юридические лица федеральный бюджет	Реализация подпрограммы позволит: - увеличить число зон отдыха с купанием, уровень качества услуг и безопасности, которые будут соответствовать международным стандартам; - уменьшить риск возникновения чрезвычайных ситуаций на водных объектах  в зонах отдыха жителей города Москвы; - обеспечить постоянную безопасность людей на водных объектах в зонах отдыха, снижение размеров ущерба природной среде и в прибрежных рекреационных зонах, а также материальных потерь в случае возникновения чрезвычайных ситуаций; - расширить возможности поисково-спасательных формирований по предупреждению происшествий на водных объектах  в зонах отдыха города Москвы и проведению аварийно-спасательных и других неотложных работ при возникновении чрезвычайных ситуаций; - минимизировать риски безопасности людей на водных объектах  в зонах отдыха; - осуществлять профилактические, воспитательные, обучающие мероприятия с применением современных информационно-коммуникационных технологий; - активно взаимодействовать с  органами исполнительной власти города Москвы в единой системе городского управления при решении задач обеспечения безопасности на водных объектах. 	2	1f938c02c7a8415d8456e6589df0f0dd	974
