Key	Code	Name	GovProgram_Id	ResponsibleFOIV_Id	ResponsibleForInput_Id	Instruments	Goals	Tasks	FinancingSources	Results	Element_Id	FullName	StatusName	Id	ord	Executor	StartDate	EndDate
159	03Д	Управление качеством услуг в сфере образования	1	5	 	 	Повышение эффективности деятельности по обеспечению потребностей граждан и общества в государственных услугах в сфере образования	совершенствование порядка предоставления государственных услуг и выполнения государственных функций в сфере образования; создание механизмов для повышения эффективности бюджетных расходов в сфере образования; повышение качества управления в сфере образования, в т.ч. за счет совершенствования системы информационного и экспертно-аналитического обеспечения принимаемых решений; модернизация системы контроля и надзора в сфере образования; обеспечение прозрачности и подотчетности деятельности органов управления образованием, расширение участия граждан, организаций и институтов гражданского общества в процедурах формирования, экспертизы и контроля принимаемых решений; обеспечение равных условий доступа к государственному финансированию государственных и негосударственных учреждений, предоставляющих качественные образовательные услуги; формирование инфраструктуры инновационной деятельности, обновления и распространения знаний в сфере образования; развитие сотрудничества системы образования города Москвы с субъектами Российской Федерации, зарубежными странами и международными организациями	всего бюджет города Москвы юридические лица федеральный бюджет	осуществление управления системой образования на основе программно-целевых принципов с использованием методов управления по результатам; обеспечение прозрачности распределения и эффективности использования общественных ресурсов в сфере образования; обеспечение   доступа  к бюджетному финансированию негосударственным организациям, оказывающим услуги в сфере дошкольного, общего образования,  дополнительного образования детей; участие гражданских институтов и родительской общественности в формировании, экспертизе и контроле принимаемых решений в сфере образования; обеспечение доступа граждан ко всем государственным услугам, предоставление которых предусмотрено в электронном виде; обеспечение доступа граждан ко всей необходимой информации в сфере образования; формирование инфраструктуры инновационной деятельности в сфере образования, обеспечивающей обновление и распространение современных знаний и технологий	2	c80fa24bc7f54104ba762158ea2b9a2b	159
489	03Г	Высшее и непрерывное профессиональное образование	1	5	 	 	Усиление вклада системы высшего и непрерывного профессионального образования в экономическое, социальное и культурное развитие города Москвы	приведение количества и профильного состава выпусков государственных образовательных учреждений высшего и непрерывного профессионального образования города Москвы в соответствие с запросами рынка труда города Москвы, повышение качества подготовки специалистов, снижение дисбаланса между ожиданиями работодателей и уровнем подготовки выпускников государственных образовательных учреждений высшего и непрерывного профессионального образования города Москвы, повышение эффективности трудоустройства выпускников государственных образовательных учреждений высшего и непрерывного профессионального образования города Москвы по полученным профессиям и специальностям, создание механизмов для использования образовательного, научного и культурного потенциала государственных образовательных учреждений высшего и непрерывного профессионального образования города Москвы в интересах города Москвы, совершенствование организационных, правовых, финансово-экономических условий функционирования системы высшего и непрерывного профессионального образования города Москвы	всего бюджет города Москвы юридические лица федеральный бюджет	интеграция в единый образовательный комплекс государственных образовательных учреждений и иных учреждений, оказывающих услуги высшего профессионального образования (городские, федеральные, негосударственные), расположенных на территории города Москвы; создание единой информационной среды профессионального образования, обеспечивающей доступ к информации о государственных образовательных учреждениях профессионального  образования, образовательных программах, трудоустройстве выпускников; включение в состав наблюдательных советов вузов, участвующих в формировании требований к компетенциям работников квалифицированного труда и содержанию программ профессионального образования, в оценке качества подготовки, работодателей, представляющих ведущие организации и организации города Москвы; прохождение подготовки по программам непрерывного профессионального образования (включая повышение квалификации и переподготовку) в государственных образовательных учреждениях высшего и дополнительного профессионального образования города Москвы не менее 60 тысячами граждан ежегодно; сертификация всеми государственными образовательными учреждениями высшего профессионального образования города Москвы систем менеджмента качества; обеспечение условий для получения высшего образования лицами с ограниченными возможностями здоровья, в т.ч. с использованием дистанционных образовательных технологий в не менее 70% государственных образовательных учреждений высшего и непрерывного профессионального образования города Москвы; реализация исследований и проектов, ориентированных на социально-экономическое развитие города Москвы в 70% государственных образовательных учреждений высшего и непрерывного профессионального образования, расположенных на территории города Москвы; трудоустройство не позднее первого года после окончания 80% выпускников государственных образовательных учреждений высшего профессионального образования города Москвы дневной (очной) формы обучения по основным образовательным программам высшего профессионального образования; вовлечение в реализацию инициатив и проектов, ориентированных на интересы города Москвы, более 20% студентов государственных образовательных учреждений высшего профессионального образования, расположенных на территории города Москвы	2	e87443270a4945a78a656eda9303e164	489
530	03Б	Общее образование	1	5	 	 	Обеспечение соответствия качества общего образования изменяющимся запросам общества и высоким мировым стандартам	развитие сети и инфраструктуры государственных образовательных учреждений общего образования и дополнительного образования детей для обеспечения доступности образовательных услуг и качественных условий обучения, независимо от территории проживания и возможностей здоровья; создание условий для учебной и социальной успешности каждого обучающегося; реализация организационно-управленческих и финансово-экономических моделей и механизмов, стимулирующих повышение эффективности деятельности государственных общеобразовательных учреждений; создание в системе образования условий для сохранения и укрепления здоровья, формирования здорового образа жизни обучающихся; вовлечение интеллектуальных и социокультурных ресурсов города Москвы в образование и социализацию детей.	всего бюджет города Москвы юридические лица федеральный бюджет	возможность выбора обучающимися программ профильного обучения и дополнительного образования обеспечена во всех районах города Москвы; доступность детей с ограниченными возможностями здоровья к качественным услугам общего образования, в т.ч. с использованием дистанционных образовательных технологий; соответствие всех государственных общеобразовательных учреждений города Москвы не менее 80% требований «Московского стандарта качества образования»; включение всех государственных общеобразовательных учреждений города Москвы в систему мониторинга здоровья обучающихся, реализация государственными общеобразовательными учреждениями города Москвы современных стандартов охраны и укрепления здоровья обучающихся; доступность услуг психологической помощи в государственных общеобразовательных учреждениях города Москвы или государственных общеобразовательных учреждениях для детей, нуждающихся в психолого-педагогической и медико-социальной помощи всем  обучающимся, испытывающим потребность в данных услугах; обеспечение информацией о своей деятельности и качестве образовательных услуг всеми государственными общеобразовательными учреждениями города Москвы; создание во всех государственных общеобразовательных учреждениях органа самоуправления, реализующего государственно-общественный характер управления и участвующего в решении вопросов стратегического управления, финансово-хозяйственной деятельности государственного общеобразовательного учреждения; предоставление возможности обучения русскому языку как неродному всем детям иностранных граждан и детям граждан Российской Федерации из других регионов; реализация всеми государственными общеобразовательными учреждениями города Москвы планов сотрудничества с организациями города Москвы (научной, технической, инновационной, культурной, спортивной, художественной, творческой направленности, а также организациями, способствующими развитию институтов гражданского общества); включение всех государственных общеобразовательных учреждений города Москвы в единую информационную систему комплексного автоматизированного мониторинга качества образования	2	93ebf17204d2433784bc7b156214ea0d	530
577	03В	Начальное и среднее профессиональное образование	1	5	 	 	Обеспечение потребностей экономики города Москвы в квалифицированных трудовых ресурсах. Усиление вклада системы профессионального образования в экономическое, социальное и культурное развитие города Москвы	приведение количества и профильного состава выпуска государственных образовательных учреждений начального и среднего профессионального образования профессионального образования в соответствие с запросами рынка труда; повышение качества подготовки специалистов, снижение дисбаланса между ожиданиями работодателей и уровнем подготовки выпускников; увеличение инвестиционной привлекательности системы начального и среднего профессионального образования и рост объемов выпуска продукции и оказания услуг, востребованных населением города Москвы; активизация потенциала государственных образовательных учреждений начального и среднего профессионального образования в интересах города Москвы.	всего бюджет города Москвы юридические лица федеральный бюджет	ликвидация дисбаланса между объемами и профильным составом выпуска государственными образовательными учреждениями начального и среднего профессионального образования квалифицированных рабочих и специалистов и запросами рынка труда города Москвы; соответствие качества подготовки государственными образовательными учреждениями начального и среднего профессионального образования квалифицированных рабочих и специалистов требованиям рынка труда города Москвы и международных рынков труда; снижение численности выпускников государственных образовательных учреждений и организаций профессионального образования, зарегистрированных в качестве безработных; повышение эффективности использования ресурсов государственных образовательных учреждений начального и среднего профессионального образования, в т.ч. в рамках организации  кластеров по видам экономической деятельности, для осуществления непрерывного профессионального образования, производства товаров и услуг, востребованных организациями и населением города Москвы	2	f152baf94635492185a9860dc189fa66	577
966	03А	Дошкольное образование	1	5	 	 	Удовлетворение потребностей населения города Москвы в доступных и качественных услугах дошкольного образования	Обеспечение доступности услуг дошкольного образования для детей дошкольного возраста; Обеспечение развития способностей каждого ребенка как основы его успешного обучения в общеобразовательном учреждении и полноценной будущей жизни; Создание условий для сохранения и укрепления здоровья воспитанников, развитие физической культуры и интереса к спорту; Повышение открытости дошкольных государственных образовательных учреждений, расширение взаимодействия с семьями	всего бюджет города Москвы юридические лица федеральный бюджет	обеспечение прозрачности комплектования дошкольных государственных образовательных учреждений для населения; охваченность разными формами дошкольного образования всех нуждающиеся в  разных формах образования и развития детей в возрасте от 3 до 7 лет, проживающие в городе Москве; предоставление возможности получения услуг по консультированию и психолого-педагогической помощи детям всех нуждающихся семей с детьми в возрасте от 1 года; соответствие всех дошкольных государственных образовательных учреждений не менее 80% требований московского стандарта качества дошкольного образования; включение всех дошкольных государственных образовательных учреждений в систему мониторинга здоровья обучающихся, реализация дошкольными государственными образовательными учреждениями современных здоровьеформирующих технологий; обеспечение информацией о своей деятельности и качестве образовательных услуг всеми дошкольными государственными образовательными учреждения; создание во всех дошкольных государственных образовательных учреждениях органа самоуправления, реализующего государственно-общественный характер управления и участвующего в решении вопросов стратегического управления, финансово-хозяйственной деятельности дошкольного образовательного учреждения; предоставление возможности обучения русскому языку как неродному всем нуждающимся детям дошкольного возраста; создание информационно-коммуникационной среды, обеспечивающей родителям возможность повысить свою компетентность в вопросах развития и воспитания детей 	2	e7dbe0ce806b4e0ca159e42f82e933e3	966
