Key	Code	Name	Id
70159860	835	Комитет по реформированию городского хозяйства города Москвы	9d65e81261564289b34d00658302c2bd
62	921	ПРЕФЕКТУРА ЗЕЛЕНОГРАДСКОГО АДМИНИСТРАТИВНОГО ОКРУГА ГОРОДА МОСКВЫ	621d62d2b1e44b759db90108476285b3
41	814	ДЕПАРТАМЕНТ КАПИТАЛЬНОГО РЕМОНТА ГОРОДА МОСКВЫ	3cab31ae9e98458784340204e501edb9
4931	202	Федеральная служба охраны Российской Федерации	6ddadf3bd85649c78c6c027a5d0a582a
22	768	КОМИТЕТ ПО ТУРИЗМУ И ГОСТИНИЧНОМУ ХОЗЯЙСТВУ ГОРОДА МОСКВЫ	2f980896624c4c649588041ed9118603
4932	095	Федеральное агентство по делам Содружества Независимых Государств, соотечественников, проживающих за рубежом, и по международному гуманитарному сотрудничеству	3daf5fffef2d44d48be3055ddc23c337
70159813	392	Пенсионный фонд Российской Федерации	67095efc8afd4b5280380733321a3094
70159853	807	КОМИТЕТ ИННОВАЦИОННОГО РАЗВИТИЯ И ВЫСТАВОЧНО-КОНГРЕССНОЙ ДЕЯТЕЛЬНОСТИ ГОРОДА МОСКВЫ	961d7aa8f4c14f94ae6f075763d76402
15	592	ДЕПАРТАМЕНТ ФИНАНСОВ ГОРОДА МОСКВЫ	5677c8257d3d452d850e090d51965d8d
4935	155	Федеральное архивное агентство	62edb9bd418649faa77a091d270b39ee
4936	260	Федеральное агентство по обустройству государственной границы Российской Федерации	da2f543a2f8042fd83130979b9a0ec2b
70159827	437	Верховный Суд Российской Федерации	1734c7d393c6461fa19509bdbe88f7fd
70159861	837	Управление государственной службы занятости населения города Москвы	8bd39dbdb531453faefd09e83266cc6d
70159844	724	Федеральная служба по финансовому мониторингу	51b0f7b38d1f49f2af010af7845adcc2
70159794	292	Российская Государственная пробирная палата при Министерстве финансов Российской Федерации	e486e121896f445c8b7b0c0a26e9a672
70159854	816	ДЕПАРТАМЕНТ ДОРОЖНО-МОСТОВОГО И ИНЖЕНЕРНОГО СТРОИТЕЛЬСТВА ГОРОДА МОСКВЫ	a0e8217e587b4e9fb9c30c3b0efd9781
70159894	975	ЮГО-ВОСТОЧНОЕ ОКРУЖНОЕ УПРАВЛЕНИЕ ОБРАЗОВАНИЯ ДЕПАРТАМЕНТА ОБРАЗОВАНИЯ ГОРОДА МОСКВЫ	3fb92d67f8304c34af160ce4c2b67dbe
4943	486	Уральское отделение Российской академии наук	63de9a042ed743c9ab970d978aaf4056
4944	310	Министерство иностранных дел Российской Федерации	c07a0e99b5d64dd9abcf0e8f7352bcd0
70159801	309	Министерство регионального развития РФ	c88dea310b7d487f99360ed1f7d60d51
4946	093	Федеральная служба страхового надзора	cbd2f159c12e4822825e0fa5cc12e920
70159893	974	УПРАВЛЕНИЕ ЗДРАВООХРАНЕНИЯ ЮГО-ВОСТОЧНОГО АДМИНИСТРАТИВНОГО ОКРУГА ГОРОДА МОСКВЫ	e065f56957b1482dadb70fcea9be025a
70159821	421	Управление федеральной регистрационной службы по Москве	421949c2b07848f6a6e0102478803568
4949	303	Управление делами Президента Российской Федерации	29a08d77058b4fb3ab3f12b7b9010247
70159725	060	Федеральная служба по надзору в сфере здравоохранения и социального развития	5e5782f904314e739be912c1090ae402
1	020	ДЕПАРТАМЕНТ ТОПЛИВНО-ЭНЕРГЕТИЧЕСКОГО ХОЗЯЙСТВА ГОРОДА МОСКВЫ	5f8d18e43eea4822b08013a0fb93bf5a
23	769	ГОСУДАРСТВЕННАЯ ИНСПЕКЦИЯ ГОРОДА МОСКВЫ ПО КАЧЕСТВУ СЕЛЬСКОХОЗЯЙСТВЕННОЙ ПРОДУКЦИИ, СЫРЬЯ И ПРОДОВОЛЬСТВИЯ	b841ca0858cd45bebb0913b028e1a8fb
65	951	ПРЕФЕКТУРА СЕВЕРО-ЗАПАДНОГО АДМИНИСТРАТИВНОГО ОКРУГА ГОРОДА МОСКВЫ	6734b93ba7944776865614c728b51cce
30	802	КОНТРОЛЬНО-СЧЕТНАЯ ПАЛАТА МОСКВЫ	48a33147a86140c4b82314fff511daa2
70159846	762	ДЕПАРТАМЕНТ ПОТРЕБИТЕЛЬСКОГО РЫНКА И УСЛУГ ГОРОДА МОСКВЫ	6b558c85f60b4254845f1728ecb37b1d
70159776	177	Министерство Российской Федерации по делам гражданской обороны, чрезвычайным ситуациям и ликвидации последствий стихийных бедствий	440fda172955405fa385174184922941
70159892	973	УПРАВЛЕНИЕ КУЛЬТУРЫ ЮГО-ВОСТОЧНОГО  АДМИНИСТРАТИВНОГО ОКРУГА ГОРОДА МОСКВЫ	35e16fd2b834433bbdcb18a233905579
70159737	085	Федеральная служба по надзору в сфере связи и массовых коммуникаций	be7e8645e24b4c8187ab1935dd6dda07
4	071	ДЕПАРТАМЕНТ ЗЕМЕЛЬНЫХ РЕСУРСОВ ГОРОДА МОСКВЫ	888119f40d744ec3a79c1ac7fb03e90c
61	911	ПРЕФЕКТУРА ЗАПАДНОГО АДМИНИСТРАТИВНОГО ОКРУГА ГОРОДА МОСКВЫ	bed526727323424c8bd31b782d495891
70159778	182	Управление Министерства РФ по налогам и сборам по г. Москве	30a96c390a2f4019af861cb012b24164
70159891	966	УПРАВЛЕНИЕ СОЦИАЛЬНОЙ ЗАЩИТЫ НАСЕЛЕНИЯ ЦЕНТРАЛЬНОГО АДМИНИСТРАТИВНОГО ОКРУГА ГОРОДА МОСКВЫ	037b5ec3a7f345e4a2a61e51fa19f51d
66	961	ПРЕФЕКТУРА ЦЕНТРАЛЬНОГО АДМИНИСТРАТИВНОГО ОКРУГА ГОРОДА МОСКВЫ	c1555e469f35449a8b562208c133f6be
4957	589	Российский гуманитарный научный фонд	01bc549fcefd4575a2102214fe24d9d6
14	262	ДЕПАРТАМЕНТ СЕМЕЙНОЙ И МОЛОДЕЖНОЙ ПОЛИТИКИ ГОРОДА МОСКВЫ	bf412dceee2a4a5eaed7223da5420ba4
4958	103	Министерство транспорта Российской Федерации	ea8bc12e65964c6aa7aa227282e29dd6
49	826	КОМИТЕТ ГОРОДА МОСКВЫ ПО ОБЕСПЕЧЕНИЮ РЕАЛИЗАЦИИ ИНВЕСТИЦИОННЫХ ПРОЕКТОВ В СТРОИТЕЛЬСТВЕ И КОНТРОЛЮ В ОБЛАСТИ ДОЛЕВОГО СТРОИТЕЛЬСТВА	35fc7e2ddaf94a24bef32337bb4757e3
4959	777	Валютно-финансовое управление города Москвы	7db4198a7ccd409097cb253f93504e0d
70159836	588	Государственная инспекция города Москвы по надзору за техническим состоянием самоходных машин и других видов техники	d2d35c316f094f37a62426077eecfe0c
69	991	ПРЕФЕКТУРА ЮЖНОГО АДМИНИСТРАТИВНОГО ОКРУГА ГОРОДА МОСКВЫ	65c6a1fecbfa4d398ce526845359341e
70159799	307	Федеральная служба по тарифам	8691bffee845415ebc702684d2c87e49
70159777	179	Управление федеральной службы по надзору в сфере связи по Москве и Московской области	160376c981bb427980c127724bc5ddbb
55	836	КОМИТЕТ ГОСУДАРСТВЕННОГО СТРОИТЕЛЬНОГО НАДЗОРА ГОРОДА МОСКВЫ	130350d134894cc9af6e27c552574de8
70159808	330	Государственная Дума Федерального Собрания Российской Федерации	53c2ec12bfe249ba84c0289479838088
36	809	ДЕПАРТАМЕНТ ТОРГОВЛИ И УСЛУГ ГОРОДА МОСКВЫ	be7f44b384d4438eb85a28f521bdc90e
4964	022	Министерство энергетики Российской Федерации	efaad88cbb0f4d5da2052980350fb6da
9	162	ДЕПАРТАМЕНТ НАУКИ, ПРОМЫШЛЕННОЙ ПОЛИТИКИ И ПРЕДПРИНИМАТЕЛЬСТВА ГОРОДА МОСКВЫ	2c85dde3c30f46d6b63329ce4f24da2d
24	773	ГЛАВНОЕ КОНТРОЛЬНОЕ УПРАВЛЕНИЕ ГОРОДА МОСКВЫ	cecdd55c897248ba8bcb2ab7cbedefff
27	788	ОБЪЕДИНЕНИЕ АДМИНИСТРАТИВНО-ТЕХНИЧЕСКИХ ИНСПЕКЦИЙ ГОРОДА МОСКВЫ	ba6cf1fe10e64127b4f42afbdfaf0dbb
70159779	184	Служба внешней разведки Российской Федерации	d5f8d70e896e4f108b152bc7761ed4d0
70159856	820	УПРАВЛЕНИЕ ГОРОДА МОСКВЫ ПО ОБЕСПЕЧЕНИЮ РЕАЛИЗАЦИИ ИНВЕСТИЦИОННЫХ ПРОЕКТОВ, КОНТРОЛЮ (НАДЗОРУ) В ОБЛАСТИ ДОЛЕВОГО СТРОИТЕЛЬСТВА	88b20c5799ed4a689cd32c533786d795
52	830	ДЕПАРТАМЕНТ КУЛЬТУРНОГО НАСЛЕДИЯ ГОРОДА МОСКВЫ	03a719e257d04e199ba62d7a4ebe64d6
70159896	983	УПРАВЛЕНИЕ КУЛЬТУРЫ ЮГО-ЗАПАДНОГО АДМИНИСТРАТИВНОГО ОКРУГА ГОРОДА МОСКВЫ	773f26bdf3ac41c8a2562da84ecfca98
70159767	161	Федеральная антимонопольная служба	81253d6cb85c453b87bd2e19ada5d81d
6	139	ДЕПАРТАМЕНТ НАУКИ И ПРОМЫШЛЕННОЙ ПОЛИТИКИ ГОРОДА МОСКВЫ	5c1917358c854eff95c32e785c7c3321
70159904	999	Остатки прошлых лет (неразрешенные)	15533db3374647e49c772ecba9befec0
35	808	КОНТРОЛЬНЫЙ КОМИТЕТ ГОРОДА МОСКВЫ	6d5b62589b544710b7102ee81316b9c7
70159852	796	Мосгосторгинспекция	51114b2d8560436cbdf12f6330589250
70159873	924	УПРАВЛЕНИЕ ЗДРАВООХРАНЕНИЯ ЗЕЛЕНОГРАДСКОГО АДМИНИСТРАТИВНОГО ОКРУГА ГОРОДА МОСКВЫ	c220065d49cc4157816e3066304b9303
8	154	ГЛАВНОЕ АРХИВНОЕ УПРАВЛЕНИЕ ГОРОДА МОСКВЫ	15e1fb0b615d46e5bcd9319d59e9960f
70159858	831	Государственная земельная инспекция города Москвы	ab39f1f3036347d0956732af653bf3d2
40	813	ДЕПАРТАМЕНТ СРЕДСТВ МАССОВОЙ ИНФОРМАЦИИ И РЕКЛАМЫ ГОРОДА МОСКВЫ	e194e98ee0464496b8d432e56d044739
54	833	КОМИТЕТ ВЕТЕРИНАРИИ ГОРОДА МОСКВЫ	99657e0cf8ac4d35a96833057d593a0a
4973	597	Федеральное государственное учреждение культуры "Государственный Эрмитаж"	bdb1861b1fd2471a9d8a338799dd9818
70159905	509	ДЕПАРТАМЕНТ РАЗВИТИЯ НОВЫХ ТЕРРИТОРИЙ ГОРОДА МОСКВЫ	6b9ea5b32d12438597bc33f691c3b445
26	781	РЕГИОНАЛЬНАЯ ЭНЕРГЕТИЧЕСКАЯ КОМИССИЯ ГОРОДА МОСКВЫ	2ad42a69ea9046ad80c733fd020fde89
70159900	993	УПРАВЛЕНИЕ КУЛЬТУРЫ ЮЖНОГО АДМИНИСТРАТИВНОГО ОКРУГА ГОРОДА МОСКВЫ	edd8fcf6c7464cb3ab8c343189410ff7
70159784	192	Федеральная миграционная служба	32ffb87a92ed40898d7837696a462d86
70159747	100	Федеральное казначейство	38330b8674094c9fac79397aa809c874
4977	409	Федеральное государственное учреждение "Государственный академический Большой театр России"	421b71a96bdb47378e193cf18ed6744d
70159857	829	Московский городской фонд обязательного медицинского страхования	88d934b57d5844d89bc73d075acf759a
70159757	141	Федеральная служба по надзору в сфере защиты прав потребителей и благополучия человека	f3341df2ae564ddfaed73df9d6adf99a
25	778	ДЕПАРТАМЕНТ ЖИЛИЩНО-КОММУНАЛЬНОГО ХОЗЯЙСТВА И БЛАГОУСТРОЙСТВА ГОРОДА МОСКВЫ	e6891ee21ec14f57853e3e081e8b4f77
70159724	059	Федеральная служба по надзору за соблюдением законодательства в сфере массовых коммуникаций и охране культурного наследия	3c42f1f7285645418d8f3f3dfff37e13
70159759	143	КОМИТЕТ ПО ДЕЛАМ МИГРАЦИИ ПРАВИТЕЛЬСТВА МОСКВЫ	5cb43ae19ea24515865840e2cf97b6a0
4982	259	Федеральное космическое агентство	0983892d6b4c4a66ab5141e72ec7760e
4983	302	Уполномоченный по правам человека в Российской Федерации	349bf1c923b94766bf234356bee5a779
70159734	081	Федеральная служба по ветеринарному и фитосанитарному надзору	5e50d36d2e234dda916b446371b5a073
70159791	273	Московское окружное управление геодезии и картографии	a558a645b46645ea86fe446c0de103de
70159807	322	Федеральная служба судебных приставов	f2b31db7cc1647a896e744b0f5411628
70159878	935	СЕВЕРНОЕ ОКРУЖНОЕ УПРАВЛЕНИЕ ОБРАЗОВАНИЯ ДЕПАРТАМЕНТА ОБРАЗОВАНИЯ ГОРОДА МОСКВЫ	5f8a3fb5c8434914b90547c791d19892
4988	074	Министерство образования и науки Российской Федерации	5662cc7f8a0e47db9db9481040a76b98
70159826	436	Конституционный Суд Российской Федерации	966674209fc142b0b65c48f7524f72af
53	832	МОСКОВСКИЙ ГОРОДСКОЙ СОВЕТ ОБЩЕСТВЕННЫХ ПУНКТОВ ОХРАНЫ ПОРЯДКА	35d29b55b9f14ce7b710497221effac5
70159865	904	УПРАВЛЕНИЕ ЗДРАВООХРАНЕНИЯ ВОСТОЧНОГО АДМИНИСТРАТИВНОГО ОКРУГА ГОРОДА МОСКВЫ	2c472b8d2cff42a9a0a949a440bf3d71
4991	416	Следственный комитет при прокуратуре Российской Федерации	8dbabb16274a49f9991449d163bf859f
4992	587	Федеральная служба по техническому и экспортному контролю	e41ed4e380954d5f87264ab62603341c
70159871	916	УПРАВЛЕНИЕ СОЦИАЛЬНОЙ ЗАЩИТЫ НАСЕЛЕНИЯ ЗАПАДНОГО АДМИНИСТРАТИВНОГО ОКРУГА ГОРОДА МОСКВЫ	8910c229d9064f328a284ba9255dcdf2
70159793	279	Федеральное агентство специального строительства	d675a6584d23439bbfc24bad8a67c36e
70159882	945	СЕВЕРО-ВОСТОЧНОЕ ОКРУЖНОЕ УПРАВЛЕНИЕ ОБРАЗОВАНИЯ ДЕПАРТАМЕНТА ОБРАЗОВАНИЯ ГОРОДА МОСКВЫ	fbb26f199d0f4aab9a214bb02d32bf93
64	941	ПРЕФЕКТУРА СЕВЕРО-ВОСТОЧНОГО АДМИНИСТРАТИВНОГО ОКРУГА ГОРОДА МОСКВЫ	a6d23f0953e54743b4e54cc8e3df8eca
70159728	073	Федеральное агентство по образованию	8d5c69cac2b548e58a344df0376fc1e0
4997	320	Федеральная служба исполнения наказаний	bffd0f525f6a40b3ac6f50660538cbac
4998	091	Федеральное агентство по делам молодежи	e9a9f5c999de4a5b8d8e50c145f80090
34	806	ДЕПАРТАМЕНТ СТРОИТЕЛЬСТВА ГОРОДА МОСКВЫ	ab92ec720b454efcb9ef515e9492f0f1
4999	167	Федеральное агентство по управлению государственным имуществом	bf687019863f4747abe052eb032f5121
70159872	923	УПРАВЛЕНИЕ КУЛЬТУРЫ ЗЕЛЕНОГРАДСКОГО АДМИНИСТРАТИВНОГО ОКРУГА ГОРОДА МОСКВЫ	ad062e996fcb43bd8acb55f109cb611b
70159888	963	УПРАВЛЕНИЕ КУЛЬТУРЫ ЦЕНТРАЛЬНОГО АДМИНИСТРАТИВНОГО ОКРУГА ГОРОДА МОСКВЫ	6f435c4700d04975a266578011f08ea2
70159890	965	ЦЕНТРАЛЬНОЕ ОКРУЖНОЕ УПРАВЛЕНИЕ ОБРАЗОВАНИЯ ДЕПАРТАМЕНТА ОБРАЗОВАНИЯ ГОРОДА МОСКВЫ	c7e972849a48401385c257e0f37a2ee4
28	789	ГОСУДАРСТВЕННАЯ ЖИЛИЩНАЯ ИНСПЕКЦИЯ ГОРОДА МОСКВЫ	58efa5991cc443b6a38d58bc3e38a195
60	901	ПРЕФЕКТУРА ВОСТОЧНОГО АДМИНИСТРАТИВНОГО ОКРУГА ГОРОДА МОСКВЫ	be06d5f62ef1464face2597f31377a24
19	735	КОМИТЕТ ОБЩЕСТВЕННЫХ СВЯЗЕЙ ГОРОДА МОСКВЫ	691a5233bb6c46d392b45aee181cea6b
70159880	943	УПРАВЛЕНИЕ КУЛЬТУРЫ СЕВЕРО-ВОСТОЧНОГО АДМИНИСТРАТИВНОГО ОКРУГА ГОРОДА МОСКВЫ	00d33c66d4564d98b74d5c0f18bc094b
50	827	ДЕПАРТАМЕНТ  ГОРОДА МОСКВЫ ПО КОНКУРЕНТНОЙ ПОЛИТИКЕ	3c89238e2aff4720a2b45c928807a681
5004	089	Государственная фельдъегерская служба Российской Федерации	1e8eaaf244de43a596875cec4a9d85f9
70159847	766	Московская Государственная вневедомственная экспертиза	ff9a4c207fa24083ada25d1184529ff6
70159768	166	Федеральное агентство по управлению федеральным имуществом	06408af5ba65418e96545df79bbeca0f
5007	169	Федеральная служба по гидрометеорологии и мониторингу окружающей среды	1c42cf4f79a7474988c760144183f2f2
70159792	277	ГУЧС Министерства РФ по городу Москве	f81ac5950e1f444393f760deb665dbc1
70159866	905	ВОСТОЧНОЕ ОКРУЖНОЕ УПРАВЛЕНИЕ ОБРАЗОВАНИЯ ДЕПАРТАМЕНТА ОБРАЗОВАНИЯ ГОРОДА МОСКВЫ	c06073d55f34492e9d47623515db4a26
70159897	984	УПРАВЛЕНИЕ ЗДРАВООХРАНЕНИЯ ЮГО-ЗАПАДНОГО АДМИНИСТРАТИВНОГО ОКРУГА ГОРОДА МОСКВЫ	06268560c0b842ddafdf62536b65fa8a
70159895	976	УПРАВЛЕНИЕ СОЦИАЛЬНОЙ ЗАЩИТЫ НАСЕЛЕНИЯ ЮГО-ВОСТОЧНОГО АДМИНИСТРАТИВНОГО ОКРУГА ГОРОДА МОСКВЫ	6eae219c8862481bbd9662b2eff81d73
70159812	388	Федеральное медико-биологическое агентство	25d723251f744f6bba5262bb172c8fd6
56	839	УПРАВЛЕНИЕ ПО ОБЕСПЕЧЕНИЮ МЕРОПРИЯТИЙ ГРАЖДАНСКОЙ ЗАЩИТЫ ГОРОДА МОСКВЫ	3570096ffb054b46a1d762f037650af2
5013	049	Федеральное агентство по недропользованию	fdc6b61bec484ca4b5326386624780af
3	056	ДЕПАРТАМЕНТ  КУЛЬТУРЫ ГОРОДА МОСКВЫ	35265434d1df475c80f9644bce4d73ee
5014	386	Федеральное государственное образовательное учреждение высшего профессионального образования "Московский государственный университет имени М.В. Ломоносова"	c0ccc28e79d84565915e65dbb485cf84
2	054	ДЕПАРТАМЕНТ ЗДРАВООХРАНЕНИЯ ГОРОДА МОСКВЫ	9c2ac29e95a44080a1ed663adfb2c06b
5015	319	Российская академия наук	d206894c57624e1e8a15673220de05cf
5016	425	Российская академия художеств	1deaa06305c645d383076a378b290bd8
70159815	394	Федеральный фонд обязательного медицинского страхования	8490da5ff6cd448388456ad8277b97a1
70159899	986	УПРАВЛЕНИЕ СОЦИАЛЬНОЙ ЗАЩИТЫ НАСЕЛЕНИЯ ЮГО-ЗАПАДНОГО АДМИНИСТРАТИВНОГО ОКРУГА ГОРОДА МОСКВЫ	2998f9af873f4f1786d96b63e846ccb8
12	188	ГЛАВНОЕ УПРАВЛЕНИЕ ВНУТРЕННИХ ДЕЛ ПО ГОРОДУ МОСКВЕ	ff7a45ab9297490aa25f6ba7387c5787
17	730	УПРАВЛЕНИЕ ЗАПИСИ АКТОВ ГРАЖДАНСКОГО СОСТОЯНИЯ ГОРОДА МОСКВЫ	68f6da59230341cd99356d2742381e89
70159889	964	УПРАВЛЕНИЕ ЗДРАВООХРАНЕНИЯ ЦЕНТРАЛЬНОГО АДМИНИСТРАТИВНОГО ОКРУГА ГОРОДА МОСКВЫ	5bd9c18e7cbc4e4babbb6d4a941f9bc0
51	828	ДЕПАРТАМЕНТ ТЕРРИТОРИАЛЬНЫХ ОРГАНОВ ИСПОЛНИТЕЛЬНОЙ ВЛАСТИ ГОРОДА МОСКВЫ	d6b477d1d4ff48699a826de80a46d7d9
5020	077	Федеральная служба по надзору в сфере образования и науки	45e4d64daa004a33aa596f3ab8a85b56
70159773	172	Федеральное агентство по техническому регулированию и метрологии	7117483b78704a01b2fd6f5769714b1b
10	163	ДЕПАРТАМЕНТ ИМУЩЕСТВА ГОРОДА МОСКВЫ	374d743f941e47e3a88673f82aa99dfe
70159868	913	УПРАВЛЕНИЕ КУЛЬТУРЫ ЗАПАДНОГО АДМИНИСТРАТИВНОГО ОКРУГА ГОРОДА МОСКВЫ	d3e70aa6ddae42fe8af7745089bc32bf
5023	423	Российская академия медицинских наук	c2a26e3b52df48aa97c6767325f8a45b
70159867	906	УПРАВЛЕНИЕ СОЦИАЛЬНОЙ ЗАЩИТЫ НАСЕЛЕНИЯ ВОСТОЧНОГО АДМИНИСТРАТИВНОГО ОКРУГА ГОРОДА МОСКВЫ	d7b03e48ec1c4dafb38277500c9c5ab8
11	164	ДЕПАРТАМЕНТ ФИЗИЧЕСКОЙ КУЛЬТУРЫ И СПОРТА ГОРОДА МОСКВЫ	a93ad06e125e448d9de87796db1c6a0e
46	823	УПОЛНОМОЧЕННЫЙ ПО ПРАВАМ ЧЕЛОВЕКА В ГОРОДЕ МОСКВЕ	afe0971c980044c8a1a678211188f75a
47	824	ДЕПАРТАМЕНТ ГРАДОСТРОИТЕЛЬНОЙ ПОЛИТИКИ ГОРОДА МОСКВЫ	8d031b41526f46b9a49f78ab3ebd3d97
70159765	157	Федеральная служба государственной статистики	0e7b493e5d454531906179c6fbfa3147
70159723	055	Министерство здравоохранения и социального развития РФ	d8d90ca7a9304d7e900979cf480355f1
70159722	053	Федеральное агентство лесного хозяйства	a25d8c775e944cc3b3c37aa6956915b5
70159809	333	Совет Федерации Федерального Собрания Российской Федерации	796740467cb3430e93a87ae87e169086
70159863	842	Комитет по контролю и регулированию инвестиционных программ города Москвы	e30df0b86ea34d3ca0507d8174214f4c
5030	721	Федеральная служба по военно-техническому сотрудничеству	9d339306189a4036af477da028f4539f
7	148	ДЕПАРТАМЕНТ СОЦИАЛЬНОЙ ЗАЩИТЫ НАСЕЛЕНИЯ ГОРОДА МОСКВЫ	a7ed8f04bd214d7e8b0c7e0abdbcd7a7
70159864	903	УПРАВЛЕНИЕ КУЛЬТУРЫ ВОСТОЧНОГО АДМИНИСТРАТИВНОГО ОКРУГА ГОРОДА МОСКВЫ	4cd7a2a024504934a2e78139ab204837
70159902	995	ЮЖНОЕ ОКРУЖНОЕ УПРАВЛЕНИЕ ОБРАЗОВАНИЯ ДЕПАРТАМЕНТА ОБРАЗОВАНИЯ ГОРОДА МОСКВЫ	147b3e4d334d46058063820c88043584
70159887	956	УПРАВЛЕНИЕ СОЦИАЛЬНОЙ ЗАЩИТЫ НАСЕЛЕНИЯ СЕВЕРО-ЗАПАДНОГО АДМИНИСТРАТИВНОГО ОКРУГА ГОРОДА МОСКВЫ	1187f2e032e7489080c0822dcdcd5a3c
4694	---	МИНИСТЕРСТВО ЭНЕРГЕТИКИ РОССИЙСКОЙ ФЕДЕРАЦИИ	d9554f3306e64f3880a58451a80b800a
70159766	160	Федеральная служба по регулированию алкогольного рынка	fd0952cdfeb448d5986c852a9e7d861c
70159756	140	Министерство экономического развития и торговли Российской Федерации	5fba3c57a2fe431aa525858d1e41ad78
5036	185	Федеральная служба по оборонному заказу	f2d62c8529834d7ea89e874634f2c47b
70159732	079	Федеральная служба по надзору в сфере связи	08d2354ac2a24d86afe887c2952661f6
5038	186	Федеральное агентство по поставкам вооружения, военной, специальной техники и материальных средств	a95c0a4cd061400499e18895347ac14e
5039	110	Федеральное агентство морского и речного транспорта	aa112a5cb0674b15aa868919edf34978
20	761	КОМИТЕТ ПО АРХИТЕКТУРЕ И ГРАДОСТРОИТЕЛЬСТВУ ГОРОДА МОСКВЫ	c0c18cdc1d70414eafb58c7efe5e93e5
70159833	521	Федеральная служба по финансовым рынкам	2eff6558e48a479f949b8d8cbe31ac5b
70159751	108	Федеральное дорожное агентство	956e893f8e16412fa7738ebe9c5c90bd
70159726	061	Федеральное агентство по здравоохранению и социальному развитию	cd7a0a9e92d64685b8358fad5c387509
59	843	УПРАВЛЕНИЕ ДЕЛАМИ МЭРА И ПРАВИТЕЛЬСТВА МОСКВЫ	3ed47f022dd949a0bb039096c8435e4a
70159716	021	Министерство промышленности и энергетики Российской Федерации	45ef47e10ebb454788c8926cc0f935c6
