№ строки	Название	Адрес	Район	Административный округ
1	Ярмарка выходного дня на Измайловская площадь, вл. 1	Измайловская пл. 1	Измайлово	ВАО
2	Ярмарка выходного дня на ул. Лухмановская,  вл. 6	Лухмановская ул. 10А	Косино-Ухтомский	ВАО
3	Ярмарка выходного дня на Зеленый пр-т,  вл. 2	Зелёный просп. 2	Перово	ВАО
4	Ярмарка выходного дня на ул. Ферганская,  вл. 17	Ферганская ул. 17	Выхино-Жулебино	ЮВАО
5	Ярмарка выходного дня на ул. Привольная,  вл. 70	Привольная ул. 70	Выхино-Жулебино	ЮВАО
6	Ярмарка выходного дня на 1-й Капотнинский проезд, вл. 12	1-й Капотнинский пр. 12 с. 1	Капотня	ЮВАО
7	Ярмарка выходного дня на ул. Юных Ленинцев,     вл. 52 у кинотеатра «Высота»	ул. Юных Ленинцев 52	Кузьминки	ЮВАО
8	Ярмарка выходного дня на Волгоградский проспект, вл. 119	Волгоградский просп. 119А	Кузьминки	ЮВАО
9	Ярмарка выходного дня на Шоссе Энтузиастов,      вл. 26 (пл. Новая)	шоссе Энтузиастов 26	Лефортово	ЮВАО
10	Ярмарка выходного дня на Цимлянская ул., вл.1	Цимлянская ул. 1 к. 1	Люблино	ЮВАО
11	Ярмарка выходного дня на Новочеркасский бульвар, вл. 19А у кинотеатра «Экран»	Новочеркасский бульв. 19	Марьино	ЮВАО
12	Ярмарка выходного дня на ул. Нижегородская, вл. 76	Нижегородская ул. 76А	Нижегородский	ЮВАО
13	Ярмарка выходного дня на ул. 3-я Карачаровская, вл. 11	3-я Карачаровская ул. 11	Нижегородский	ЮВАО
14	Ярмарка выходного дня на ул. Шоссейная,  вл. 4	Шоссейная ул. 4 к. 1	Печатники	ЮВАО
15	Ярмарка выходного дня на Люберецкие поля, ул. Рождественская,  вл. 23/33	Рождественская ул. 23/33	Некрасовка	ЮВАО
16	Ярмарка выходного дня на ул. 1-я Новокузьминская, вл. 21	1-я Новокузьминская ул. 21	Рязанский	ЮВАО
17	Ярмарка выходного дня на ул. Михайлова, вл. 29	ул. Михайлова 29 к. 1	Рязанский	ЮВАО
18	Ярмарка выходного дня на Волгоградский пр-т, вл.46	Волгоградский просп. 46/15	Текстильщики	ЮВАО
19	Ярмарка выходного дня на ул. Трофимова,  вл. 17	ул. Трофимова 17	Южнопортовый	ЮВАО
20	Ярмарка выходного дня на ул. Михневская, вл.9/1	Михневская ул. 9 к. 1	Бирюлево Восточное	ЮАО
21	Ярмарка выходного дня на ул. Булатниковская, вл. 9/1	Булатниковская ул. 9	Бирюлево Западное	ЮАО
22	Ярмарка выходного дня на ул. Борисовкие пруды,   вл. 26, стр.2	ул. Борисовские Пруды 26	Братеево	ЮАО
23	Ярмарка выходного дня на ул. Восточная, вл. 26	Восточная ул.	Даниловский	ЮАО
24	Ярмарка выходного дня на 1-й Донской проезд	1-й Донской пр.	Донской	ЮАО
25	Ярмарка выходного дня на ул. Бирюлевская, вл. 17	Бирюлёвская ул. 17	Бирюлево Восточное	ЮАО
26	Ярмарка выходного дня на улице Шипиловская, вл.48-50А	Шипиловская ул. 50	Зябликово	ЮАО
27	Ярмарка выходного дня на ул. Кантемировская,      вл. 14	Кантемировская ул. 14	Москворечье-Сабурово	ЮАО
28	Ярмарка выходного дня на Нагатинская набережная, вл. 20-22	Нагатинская наб. 20	Нагатино-Садовники	ЮАО
29	Ярмарка выходного дня на ул. Судостроительная, вл.10	Судостроительная ул. 10 к. 1	Нагатинский затон	ЮАО
30	Ярмарка выходного дня на ул. Новинки, вл. 31	ул. Новинки 31	Нагатинский затон	ЮАО
31	Ярмарка выходного дня на ул. Домодедовская,       вл. 12	Домодедовская ул. 12	Орехово-Борисово Северное	ЮАО
32	Ярмарка выходного дня на ул. Домодедовская,       вл. 15	Ореховый бульв. 14 к. 1	Орехово-Борисово Южное	ЮАО
33	Ярмарка выходного дня на ул. Ясеневая, вл. 30	Ясеневая ул. 28	Орехово-Борисово Южное	ЮАО
34	Ярмарка выходного дня на Пролетарский проспект, вл. 24	Пролетарский просп. 24	Царицыно	ЮАО
35	Ярмарка выходного дня в Микрорайоне Чертаново Северное, вл.823	мкр. Северное Чертаново  к. 823	Чертаново Северное	ЮАО
36	Ярмарка выходного дня на ул. Красного Маяка, вл. 3	ул. Красного Маяка 3	Чертаново Центральное	ЮАО
37	Ярмарка выходного дня на ул. Чертановская, вл 65	Чертановская ул. 65	Чертаново Южное	ЮАО
38	Ярмарка выходного дня на Россошанскийпр., вл. 3-5	Россошанский пр. 3	Чертаново Южное	ЮАО
39	Ярмарка выходного дня на ул. М.Юшуньская, вл. 1	Малая Юшуньская ул. 1 к. 1	Зюзино	ЮЗАО
40	Ярмарка выходного дня на ул. Профсоюзная вл. 91	Профсоюзная ул. 91	Коньково	ЮЗАО
41	Ярмарка выходного дня на Нагорный б-р, вл. 8-9	Нагорный бульв. 9	Котловка	ЮЗАО
42	Ярмарка выходного дня на ул. Гарибальди, вл. 4	ул. Гарибальди 4Г	Ломоносовский	ЮЗАО
43	Ярмарка выходного дня на ул. Крупской, вл. 9	ул. Крупской 9	Ломоносовский	ЮЗАО
44	Ярмарка выходного дня на ул. Академика Челомея, вл. 8, к.1	ул. Академика Челомея 8 к. 1	Обручевский	ЮЗАО
45	Ярмарка выходного дня на Б-р. Дм. Донского, вл. 9, корп.1	бульв. Дмитрия Донского 9 к. 1	Северное Бутово	ЮЗАО
46	Ярмарка выходного дня на Ленинский пр-т, вл. 125/1	Ленинский просп. 125 к. 1	Тёплый Стан	ЮЗАО
47	Ярмарка выходного дня на ул. Генерала Тюленева, вл. 4 А	ул. Генерала Тюленева 4А с. 1	Тёплый Стан	ЮЗАО
48	Ярмарка выходного дня на ул. Южнобутовская,      вл. 50, к.4 (напротив)	Южнобутовская ул. 50 к. 4	Южное Бутово	ЮЗАО
49	Ярмарка выходного дня на ул. Маршала Савицкого, вл. 8-12 (напротив)	ул. Маршала Савицкого 8	Южное Бутово	ЮЗАО
50	Ярмарка выходного дня на ул. Тарусская, вл. 14	Тарусская ул. 14	Ясенево	ЮЗАО
51	Ярмарка выходного дня на Вокзальная площадь	Вокзальная пл.	Южное Бутово	ЮЗАО
52	Ярмарка выходного дня на ул. Мосфильмовская, местный проезд вл. 16-20	Мосфильмовская ул. 16	Раменки	ЗАО
53	Ярмарка выходного дня на ул. Раменки, вл. 3	ул. Раменки 3	Раменки	ЗАО
54	Ярмарка выходного дня на ул. Ярцевская, вл. 21 площадка у кинотеатра «Брест»	Ярцевская ул. 21 к. 1	Кунцево	ЗАО
55	Ярмарка выходного дня на ул. Сеславинская, вл. 12	Сеславинская ул. 12 к. 2	Филевский парк	ЗАО
56	Ярмарка выходного дня на ул. 1812 года,  вл. 15	ул. 1812 Года 15	Дорогомилово	ЗАО
57	Ярмарка выходного дня на Осенний бульвар, вл. 11 (площадь Защитников Неба Москвы)	Осенний бульв. 11	Крылатское	ЗАО
58	Ярмарка выходного дня на ул.Н.Ковшовой, вл. 6-8	ул. Наташи Ковшовой 6А	Очаково-Матвеевское	ЗАО
59	Ярмарка выходного дня на ул. Богданова, вл. 52-54	ул. Богданова 54	Солнцево	ЗАО
60	Ярмарка выходного дня на ул. Олеко Дундича, вл. 29	ул. Олеко Дундича 29	Фили-Давыдково	ЗАО
61	Ярмарка выходного дня на ул. Ватутина, вл.18.корп.2	ул. Ватутина 18 к. 2	Фили-Давыдково	ЗАО
62	Ярмарка выходного дня на Троилинский пер., вл. 4/7	Троилинский пер. 4/7	Арбат	ЦАО
63	Ярмарка выходного дня на ул. Забелина, вл. 2	ул. Забелина 3 с. 2	Басманный	ЦАО
64	Ярмарка выходного дня на Гусятников пер., вл. 1-3	Гусятников пер. 3/1 с. 1	Басманный	ЦАО
65	Ярмарка выходного дня на ул. Аэрофлотская, вл. 8А	Аэрофлотская ул. 8	Внуково	ЗАО
66	Ярмарка выходного дня на 2-й Новокузнецкий пер.	2-й Новокузнецкий пер.	Замоскворечье	ЦАО
67	Ярмарка выходного дня на Панкратьевский пер.	Панкратьевский пер.	Красносельский	ЦАО
68	Ярмарка выходного дня на ул. Щепкина, вл. 32-38	ул. Щепкина 38 с. 2	Мещанский	ЦАО
69	Ярмарка выходного дня на ул. Верземнека, вл. 3-7	ул. Верземнека 3	Мещанский	ЦАО
70	Ярмарка выходного дня на Тишинская пл, вл. 6	Тишинская пл. 6	Пресненский	ЦАО
71	Ярмарка выходного дня на ул. Школьная	Школьная ул. 48	Таганский	ЦАО
72	Ярмарка выходного дня на 5-й Котельнический пер.	5-й Котельнический пер.	Таганский	ЦАО
73	Ярмарка выходного дня на Сытинский пер.	1-й Волконский пер.	Тверской	ЦАО
74	Ярмарка выходного дня на Долгоруковская ул. вл. 40	Долгоруковская ул. 40	Тверской	ЦАО
75	Ярмарка выходного дня на ул. Донская, вл. 19-29	Донская ул. 29 с. 2	Якиманка	ЦАО
76	Ярмарка выходного дня на ул. Б.Полянка, вл.  28	ул. Большая Полянка 28 к. 1	Якиманка	ЦАО
77	Ярмарка выходного дня на Комсомольском пр-те, д. 22-24 (дублёр)	Комсомольский просп. 22	Хамовники	ЦАО
78	Ярмарка выходного дня на Бескудниковский б-р,   вл. 12	Бескудниковский бульв. 12	Бескудниковский	САО
79	Ярмарка выходного дня на ул. Маршала Федоренко, вл. 14, к.3	ул. Маршала Федоренко 14 к. 3	Западное Дегунино	САО
80	Ярмарка выходного дня на ул. Зеленоградская, вл 15	Зеленоградская ул.	Ховрино	САО
81	Ярмарка выходного дня на Ст. Петровско-Разумовский пр-д,         вл. 1/23	Старый Петровско-Разумовский пр. 1/23 с. 1	Савеловский	САО
82	Ярмарка выходного дня на ул. Флотская,  вл. 25	Флотская ул. 25Б	Головинский	САО
83	Ярмарка выходного дня на ул. Новокосинская,         вл. 14	Новокосинская ул. 14 к. 7	Новокосино	ВАО
84	Ярмарка выходного дня на ул. Суздальская,  вл. 11	Суздальская ул. 11Б	Новокосино	ВАО
85	Ярмарка выходного дня на проезд Березовой рощи, вл. 3	пр. Берёзовой Рощи 3 с. 1	Хорошевский	САО
86	Ярмарка выходного дня на Дмитровское шоссе, вл.131	Дмитровское шоссе 131 к. 1	Дмитровский	САО
87	Ярмарка выходного дня на ул. Снежная,  вл. 18	Снежная ул. 18	Свиблово	СВАО
88	Ярмарка выходного дня на ул. Бажова (на площадке в сквере)	ул. Бажова 8	Ростокино	СВАО
89	Ярмарка выходного дня на ул. Тайнинская, вл. 24	Тайнинская ул. 24	Лосиноостровский	СВАО
90	Ярмарка выходного дня на ул. Шереметьевская, вл. 2,стр. 1	Шереметьевская ул. 2 с. 1	Марьина роща	СВАО
91	Ярмарка выходного дня на ул. Лескова, вл. 14 (площадь у кинотеатра «Будапешт»)	ул. Лескова 14	Бибирево	СВАО
92	Ярмарка выходного дня на Ярославское шоссе, вл. 114	Ярославское шоссе 114	Ярославский	СВАО
93	Ярмарка выходного дня на ул. Сухонская, вл. 9	Сухонская ул.	Северное Медведково	СВАО
94	Ярмарка выходного дня на ул. Инженерная, вл. 1-3	Инженерная ул. 1	Алтуфьевский	СВАО
95	Ярмарка выходного дня на ул. П.Корчагина,  вл. 2	ул. Павла Корчагина 2	Алексеевский	СВАО
96	Ярмарка выходного дня на 9-я Северная линия, вл. 21	9-я Северная линия 21	Северный	СВАО
97	Ярмарка выходного дня на Дмитровское шоссе, микр.   № 9	Дмитровское шоссе 165Е к. 7	Северный	СВАО
98	Ярмарка выходного дня на ул. Руставели, вл. 3	ул. Руставели	Бутырский	СВАО
99	Ярмарка выходного дня на ул. Уссурийская,  вл. 7	Уссурийская ул. 7	Гольяново	ВАО
100	Ярмарка выходного дня на ул. Хабаровская, вл. 12/23	Хабаровская ул. 12/23	Гольяново	ВАО
101	Ярмарка выходного дня на Измайловский проспект,       вл. 91	Измайловский просп. 91 к. 1	Восточное Измайлово	ВАО
102	Ярмарка выходного дня на ул. Челябинская,  вл. 15	Челябинская ул. 15	Ивановское	ВАО
103	Ярмарка выходного дня на ул. Молостовых,  вл. 13	ул. Молостовых 13 к. 1	Ивановское	ВАО
104	Ярмарка выходного дня на ул. 2-я Сокольническая, вл. 3	2-я Сокольническая ул. 3	Сокольники	ВАО
105	Ярмарка выходного дня, Окская ул., вл.3-5	Окская ул. 3 к. 1	Рязанский	ЮВАО
106	Ярмарка выходного дня Новосходненское шоссе, вл. 166	Новосходненское шоссе 166	Молжаниновский	САО
107	Ярмарка выходного дня на ул. Зои и Александра Космодемьянских вл. 23	ул. Зои и Александра Космодемьянских 23	Коптево	САО
108	Ярмарка выходного дня на улице Полярная, вл.10	Полярная ул. 10	Южное Медведково	СВАО
109	Ярмарка выходного дня на Старокирочном пер. 1/47	Старокирочный пер. 5 с. 1	Басманный	ЦАО
110	Ярмарка выходного дня на Староватутинский пр.4	Староватутинский пр. 4	Бабушкинский	СВАО
111	Ярмарка выходного дня на улице Хачатуряна вл.13 пересечение с улицей Санникова	ул. Хачатуряна 13	Отрадное	СВАО
112	Ярмарка выходного дня ул.Руставели, вл.3	ул. Руставели 3	Бутырский	СВАО
113	Ярмарка выходного дня на ул. Новопеределкинская, вл.14А	Новопеределкинская ул. 14	Ново-Переделкино	ЗАО
114	Ярмарка выходного дня на ул. Красноармейская, д. 36-38	Красноармейская ул. 36	Аэропорт	САО
115	Ярмарка выходного дня на Дмитровском ш. вл. 13, к. 2-5	Дмитровское шоссе 13 к. 3	Тимирязевский	САО
116	Ярмарка Выходного дня на ул. Перерва, 43, стр.1	ул. Перерва 43 к. 1	Марьино	ЮВАО
117	Ярмарка выходного дня на ул. Аэрофлотская, вл.8А	Аэрофлотская ул. 8А с. 1	Внуково	ЗАО
118	Ярмарка выходного дня на Ленинградский пр-т, вл. 33, к. 1	Ленинградский просп. 33 к. 1	Беговой	САО
119	Ярмарка выходного дня на ул. Удальцова, 75А	ул. Удальцова 75А	Проспект Вернадского	ЗАО
120	Ярмарка выходного дня на Лианозовском проезде, вл.1	Лианозовский пр. 1	Лианозово	СВАО
121	Ярмарка выходного дня на ул. 800-летия Москвы, вл. 11, корп. 6	ул. 800-летия Москвы 11 к. 6	Восточное Дегунино	САО
122	3-я Радиаторская	3-я Радиаторская ул. 5 к. 1	Войковский	САО
123	Ярмарка выходного дня на 3-я Радиаторская ул. вл.5	3-я Радиаторская ул. 5 к. 1	Войковский	САО
124	Ярмарка выходного дня на Булатниковском проезде, вл.14	Булатниковский пр. 14 к. 6	Бирюлево Западное	ЮАО
125	Ярмарка выходного дня на ул. Фестивальная д. 21-25	Фестивальная ул. 21	Левобережный	САО
126	Ярмарка выходного дня	1-й пр. Марьиной рощи	Марьина роща	СВАО
127	Ярмарка на Бунинской аллее, д.9	ул. Бунинская Аллея 9	Южное Бутово	ЮЗАО
128	Ярмарка Выходного дня на ул. Старобитцевская, 19 (напротив)	Старобитцевская ул. 19 к. 1	Северное Бутово	ЮЗАО
129	Ярмарка выходного дня на ул. Рокотова, вл. 5	ул. Рокотова 5	Ясенево	ЮЗАО
130	Ярмарка выходного дня на Мичуринский пр-т, Олимпийская деревня, вл.3	ул. Мичуринский Проспект, Олимпийская Деревня 3	Тропарево-Никулино	ЗАО
131	Ярмарка выходного дня на ул. Маршала Катукова, вл. 8	ул. Маршала Катукова 8	Строгино	СЗАО
132	Ярмарка выходного дня на ул. Маршала Тухачевского, вл. 32-34	ул. Маршала Тухачевского 32	Хорошево-Мневники	СЗАО
133	Ярмарка выходного дня на ул. Щукинская, вл. 42	Щукинская ул. 42	Щукино	СЗАО
134	Ярмарка выходного дня на Пятницкое шоссе, вл. 18	Пятницкое шоссе 18	Митино	СЗАО
135	Ярмарка выходного дня на б-ре Яна Райниса, вл.2 (сквер)	бульв. Яна Райниса 2	Северное Тушино	СЗАО
136	Ярмарка выходного дня на ул. Туристская, вл.6	Туристская ул. 6 к. 1	Южное Тушино	СЗАО
137	Ярмарка выходного дня на ул.Тушинская, вл. 15	Тушинская ул. 17	Покровское-Стрешнево	СЗАО
138	Ярмарка выходного дня на площади Юности	Зеленоград, пл. Юности	Матушкино	ЗелАО
139	Ярмарка выходного дня на у Михайловских прудов (15 микрорайон)	Зеленоград  к. 1550	Крюково	ЗелАО
140	Ярмарка выходного дня на ул.Гримау д.12	ул. Гримау 12	Академический	ЮЗАО
141	Ярмарка выходного дня на ул. Новочеремушкинской 53 А	Новочерёмушкинская ул. 53А	Черёмушки	ЮЗАО
142	Ярмарка выходного дня на ул. Цандера, д. 7/2А	ул. Цандера 7 к. 2А	Останкинский	СВАО
143	Ярмарка выходного дня на ул. Наташи Ковшовой вл. 6-8	ул. Наташи Ковшовой 6	Очаково-Матвеевское	ЗАО
144	Ярмарка выходного дня на ул. Западной вл.1	Западная ул. 1	Восточный	ВАО
145	Ярмарка выходного дня на пересечении ул. Толбухина с ул. Барвихинская	ул. Маршала Неделина 4	Можайский	ЗАО
146	Ярмарка выходного дня, Чонгарский б-р, вл.7	Чонгарский бульв. 7/1	Нагорный	ЮАО
147	Лухмановская 6	Лухмановская ул. 5	Косино-Ухтомский	ВАО
148	Ярмарки выходного дня на ул. Нагатинской вл. 35	Нагатинская ул. 35 к. 3	Нагатино-Садовники	ЮАО
149	Ярмарки выходного дня на Нагатинской набережной вл. 20-22	Нагатинская наб. 22	Нагатино-Садовники	ЮАО
150	Ярмарка выходного дня на проспект Вернадского, вл. 7	просп. Вернадского 7	Гагаринский	ЮЗАО
